year;index;data-afisare;data-creare;data-cerere;nr.cerere;regim-h;actiune;tip-lucrari;adresa;titlu
2017;1323;28-09-2017;20-09-2017;398721;04-09-2017;;bransare;;"judetul Cluj, Strada Constanta, nr. 8-10";"REDIMENSIONARE BRANSAMENT APA SI RACORD CANAL"
2017;1324;28-09-2017;16-09-2017;378712;21-08-2017;;construire;locuinte colective;"judetul Cluj, Strada Oasului, nr. 86-90";"MODIFICARI PE PARCURSUL EXECUTIEI LA LUCRARILE AUTORIZATE CU A.C. nr.804/16.06.2016 PENTRU CONSTRUIRE IMOBIL DE LOCUINTE COLECTIVE -CORP M1 SI M2, CONFORM PUZ SI PUD APROBAT CU HCL 373/26.06.2007, REGIM DE INALTIME S+P+5E+Er. Modificarile propuse: modificare compartimentare interioara, modificare finisaje la fatade, se incadreaza in limitele avizelor si acordurilor obtinute. In urmatoarele conditii:  Se interzice modificarea parcelarului pana la receptionarea lucrarilor si eliberarea certificatului de atestare a edificarii constructiei."
2017;1325;28-09-2017;16-09-2017;380716;22-08-2017;S+P+E;construire,amenajare;locuinte unifamiliale-izolate,imprejmuire,amenajari exterioare;"judetul Cluj, Budai Deleanu Ion, Strada, nr. 1";"CASĂ UNIFAMILIALĂ S+P+E, ÎMPREJMUIRE, AMENAJARI EXTERIOARE. In urmatoarele conditii:  Se interzice modificarea parcelarului pana la receptionarea lucrarilor si eliberarea certificatului de atestare a edificarii constructiei."
2017;1326;28-09-2017;16-09-2017;384063;24-08-2017;P+E;extindere,etajare,amenajare;locuinte unifamiliale-izolate,amenajari exterioare;"judetul Cluj, Strada Nadasel, nr. 26";"EXTINDERE SI ETAJARE CASĂ FAMILIALĂ EXISTENTA CU REGIM FINAL DE ÎNĂLŢIME P+E ŞI 2 UNITATI LOCATIVE, AMENAJARI EXTERIOARE. In urmatoarele conditii:  Se interzice modificarea parcelarului pana la receptionarea lucrarilor si eliberarea certificatului de atestare a edificarii constructiei."
2017;1327;28-09-2017;16-09-2017;386639;25-08-2017;Dp+P+Ep;construire,continuare lucrari;birouri,imprejmuire,hala;"judetul Cluj, Muncii, Bulevard, nr. 73";"CONTINUARE FARA MODIFICARE LUCRARI DE CONSTRUIRE HALA Dp+P+Ep PENTRU ATELIER DE TAMPLARIE SI BIROURI, ÎMPREJMUIRE PROPRIETATE, AUTORIZATE CU A.C. nr.1430/10.08.2005. In urmatoarele conditii:  Se interzice modificarea parcelarului pana la receptionarea lucrarilor si eliberarea certificatului de atestare a edificarii constructiei."
2017;1328;28-09-2017;16-09-2017;392356;30-08-2017;S+P+E;etajare,amenajare;locuinte unifamiliale-izolate,imprejmuire,amenajari exterioare;"judetul Cluj, Strada Lucernei, nr. 7";"REABILITARE SI ETAJARE LOCUINTA UNIFAMILIALĂ CU REGIM FINAL DE ÎNĂLŢIME S+P+E, ÎMPREJMUIRE LA STRADA, AMENAJARI EXTERIOARE. In urmatoarele conditii:  Se interzice modificarea parcelarului pana la receptionarea lucrarilor si eliberarea certificatului de atestare a edificarii constructiei."
2017;1329;28-09-2017;25-09-2017;388565;28-08-2017;;construire;;"judetul Cluj, Sabin Dragoi, nr. 4";"BRASAMENT DE APA"
2017;1330;28-09-2017;28-09-2017;426622;20-09-2017;;reparatie;acoperis;"judetul Cluj, Napoca , nr. 25";"REPARATII FATADA SI INVELITOARE"
2017;1331;28-09-2017;28-09-2017;378960;21-08-2017;;construire,amenajare;comert,servicii,imprejmuire;"judetul Cluj, CAMPINA, nr. 51-53";"CONSTRUIRE UNITATE DE PRODUCTIE, COMERCIALA SI DE SERVICII – CORP 5,  AMENAJARE INCINTA, IMPREJMUIRE TEREN, ORGANIZARE SANTIER"
2017;1332;28-09-2017;28-09-2017;374859;17-08-2017;;reparatie,schimbare destinatie,amenajare;amenajari interioare;"judetul Cluj, Traian Vuia, nr. 97A";"AMENAJARI INTERIOARE SI REPARATII LA CORP C2 SI SCHIMBARE DESTINATIE IN SPATIU MULTIFUNCTIONAL"
2017;1333;28-09-2017;28-09-2017;384558;24-08-2017;;amenajare;locuinte colective,amenajari interioare;"judetul Cluj, Aleea Herculane, nr. 3, et. 9, ap. 37";"AMENAJARI INTERIOARE APARTAMENT"
2017;1334;29-09-2017;21-09-2017;407283;07-09-2017;;bransare;;"judetul Cluj, D.D. Rosca, nr. 37 D-E";"BRANSAMENT DE GAZE NATURALE DE PRESIUNE REDUSĂ ( in montaj subteran ) si P.R."
2017;1335;29-09-2017;29-09-2017;399648;04-09-2017;;bransare;;"judetul Cluj, VORONET, nr. 87K";"BRANSAMENT SI POST REGLARE-MASURARE GAZE NATURALE PRESIUNE REDUSĂ"
2017;1336;29-09-2017;29-09-2017;411869;11-09-2017;P+E,Sp+P+E;extindere,amenajare;locuinte unifamiliale-izolate,imprejmuire,amenajari exterioare;"judetul Cluj, AIUDULUI, nr. 48";"EXTINDERE CU REGIM DE INALTIME P+E CASA UNIFAMILIALA Sp+P+E EXISTENTA REZULTAND DOUA UNITATI LOCATIVE, REAMENAJARE PARCELA, AMENAJARI EXTERIOARE SI IMPREJMUIRE LA STRADA"
2017;1337;29-09-2017;29-09-2017;359545;04-08-2017;;construire;;"judetul Cluj, Strada Bancila Octav";"ÎMBUNĂTĂȚIRE NIVELE DE TENSIUNE ȘI INJECȚIE DE PUTERE STR. ION IIONESCU DE LA BRAD , STR. CPT. GRIGORE IGNAT"
2017;1338;29-09-2017;22-09-2017;387696;28-08-2017;;bransare;;"judetul Cluj,  BORHANCIULUI NR. 76G BL. 2A,2B,2C,2D";"4 BRANSAMENTE DE GAZE NATURALE DE PRESIUNE REDUSA ( in montaj subteran) , 4 P.R."
2017;1339;29-09-2017;04-08-2017;428995;21-09-2017;;extindere,bransare;;"judetul Cluj, Dâmboviței   nr. 99  bl. A sc.II";"EXTINDERE  CONDUCTA  GAZ DE PRESIUNE REDUSA  ȘI BRANSAMENT DE GAZE NATURALE DE PRESIUNE REDUSĂ ( in montaj subteran ) si P.R."
2017;1340;29-09-2017;29-09-2017;410379;11-09-2017;P+M;amenajare;;"judetul Cluj, Strada Maramuresului, nr. 115";"AMENAJARE MANSARDA IN VOLUMERIA POD EXISTENT Regimul de inaltime P+M"
2017;1341;29-09-2017;29-09-2017;416103;13-09-2017;;extindere,bransare;;"judetul Cluj, Strada Dropiei, nr. 26A";"Extindere conducta de gaze naturale presiune redusa,bransament gaz presiune redusa si refacere drum"
2017;1342;29-09-2017;29-09-2017;408341;08-09-2017;S+P+E+M;construire;locuinte unifamiliale-izolate;"judetul Cluj, Strada Donath, nr. 248";"Locuinta semicolectiva cu doua unitati locative cu reg. S+P+E+M"
2017;1343;2-10-2017;22-09-2017;390730;29-08-2017;;bransare;;"judetul Cluj, TRIFOIULUI NR.22-28";"ALIMENTARE CU ENERGIE ELECTRICĂ IMOBIL EXISTENT ( branșament electric în montaj subteran)."
2017;1344;2-10-2017;02-10-2017;388581;28-08-2017;P+E;continuare lucrari,amenajare;locuinte unifamiliale-izolate,imprejmuire,amenajari exterioare;"judetul Cluj, HENRI COANDA, nr. 18";"CONTINUARE LUCRARI FARA MODIFICAREA SOLUTIEI CONSTRUCTIVE AUTORIZATE INITIAL CU AC NR.1034 DIN 18.09.2014 PENTRU „LOCUINTA UNIFAMILIALA P+E, IMPREJMUIRE TEREN SI AMENAJARI EXTERIOARE”"
2017;1345;2-10-2017;02-10-2017;406525;07-09-2017;P+E;modificare solutie,amenajare;locuinte unifamiliale-cuplate,imprejmuire,amenajari exterioare;"judetul Cluj, Voronet, nr. 73";"MODIFICARE DE SOLUTIE LA DOUA LOCUINTE UNIFAMILIALE CUPLATE  CU REGIM DE INALTIME P+E, IMPREJMUIRE SI AMENAJARI EXTERIOARE AUTORIZATE CU A.C. NR.1155/19.07.2016  Modificari propuse: modificare fatade si amenajari exterioare, modificare tip imprejmuire – cu incadrarea in limitele avizelor/acordurilor obtinute pentru autorizatia initiala."
2017;1346;3-10-2017;03-10-2017;367537;10-08-2017;S+P+7E,S+P+7E,S2+S1+P+7E;construire,amenajare;amenajari exterioare;"judetul Cluj, CAMPUL PAINII, nr. 12";"INTRARE IN LEGALITATE CONFORM PROCESULUI VERBAL DE CONTROL NR.19120 DIN 21.04.2017 INTOCMIT DE I.S.C. CLUJ – MODIFICARE SOLUTIE CONSTRUCTIVA AUTORIZATA INITIAL CU AC 1252 DIN 01.08.2016 PENTRU „CONSTRUIRE IMOBIL CU FUNCTIUNI MIXTE, CU REGIM DE INALTIME S+P+7E SI AMENAJARI EXTERIOARE” MODIFICARI PROPUSE: MODIFICAREA REGIMULUI DE INALTIME DE LA S+P+7E LA S2+S1+P+7E PRIN COBORAREA COTEI RADIERULUI SI EXECUTAREA UNUI SUBSOL SUPLIMENTAR."
2017;1347;3-10-2017;03-10-2017;399503;04-09-2017;;bransare;;"judetul Cluj, SPERANTEI, nr. 17 D-E";"BRANSAMENT GAZE NATURALE"
2017;1348;3-10-2017;03-10-2017;389531;29-08-2017;;construire;;"judetul Cluj, PIAȚA MUZEULUI  NR.4";"REDIMENSIONARE  BRANSAMENT  APĂ."
2017;1349;3-10-2017;25-09-2017;399377;04-09-2017;;bransare;;"judetul Cluj, ZEFIRULUI NR. 12";"ALIMENTARE CU ENERGIE ELECTRICA IMOBIL( branșament electric trifazic în  montaj subteran)."
2017;1350;3-10-2017;03-10-2017;406508;07-09-2017;P+E;modificare solutie,amenajare;locuinte unifamiliale-izolate,locuinte colective,imprejmuire,amenajari exterioare;"judetul Cluj, Buzias, nr. 11";"MODIFICARE DE SOLUTIE LA CASA P+E CU 2 APARTAMENTE, IMPREJMUIRE SI AMENAJARI EXTERIOARE AUTORIZATE CU A.C. NR.1152/19.07.2016.  Modificari propuse: modificare fatade, modificare amenajari exterioare si imprejmuire – cu incadrarea in limitele avizelor/acordurilor obtinute pentru autorizatia initiala."
2017;1351;3-10-2017;03-10-2017;406513;07-09-2017;P+E;modificare solutie,amenajare;locuinte unifamiliale-izolate,locuinte colective,imprejmuire,amenajari exterioare;"judetul Cluj, Buzias, nr. 13";"MODIFICARE DE SOLUTIE LA CASA P+E CU 2 APARTAMENTE, IMPREJMUIRE SI AMENAJARI EXTERIOARE AUTORIZATE CU A.C. NR.1026/13.07.2016.   Modificari propuse: modificare fatade, renuntare la intrarea tip windfang, modificare amenajari exterioare si imprejmuire – cu incadrarea in limitele avizelor/acordurilor obtinute pentru autorizatia initiala."
2017;1352;3-10-2017;13-09-2017;404262;06-09-2017;S+P+M;extindere,etajare,continuare lucrari,consolidare,amenajare;locuinte unifamiliale-izolate,imprejmuire,amenajari exterioare;"judetul Cluj, Strada Barc II, nr. 27A";"CONTINUAREA LUCRARILOR DE CONSOLIDARE, EXTINDERE SI MANSARDARE CASA UNIFAMILIALA CU REGIM FINAL DE INALTIME S+P+M, CHIOSC DE GRADINA, AMENAJARI EXTERIOARE, IMPREJMUIRE PROPRIETATE AUTORIZATE CU A.C. NR.728 DIN 29.06.2010 SI NR.1122 DIN 11.09.2013"
2017;1353;3-10-2017;20-09-2017;399837;04-09-2017;S+P+E,P;construire,amenajare;locuinte unifamiliale-izolate,imprejmuire,amenajari exterioare;"judetul Cluj, Aleea Socului, nr. 10";"LOCUINTA UNIFAMILIALA CU REGIM DE INALTIME S+P+E, IMPREJMUIRE SI AMENAJARI EXTERIOARE conform P.U.Z. aprobat cu H.C.L. nr. 334 din 22.09.2015."
2017;1354;3-10-2017;20-09-2017;399877;04-09-2017;S+P+E,P;construire,amenajare;locuinte unifamiliale-izolate,imprejmuire,amenajari exterioare;"judetul Cluj, Aleea Socului, nr. 12";"LOCUINTA UNIFAMILIALA CU REGIM DE INALTIME S+P+E, IMPREJMUIRE SI AMENAJARI EXTERIOARE conform P.U.Z. aprobat cu H.C.L. nr. 334 din 22.09.2015."
2017;1355;4-10-2017;04-10-2017;378638;21-08-2017;P+E;construire,amenajare;locuinte unifamiliale-izolate,imprejmuire,amenajari exterioare;"judetul Cluj, nr. 38G";"CONSTRUIRE LOCUINTA INDIVIDUALA P+E PARTIAL, IMPREJMUIRE SI AMENAJARI EXTERIOARE"
2017;1356;4-10-2017;04-10-2017;376296;18-08-2017;;modificari interioare,amenajare;amenajari interioare;"judetul Cluj, Corneli Coposu, nr. 12A";"REAMENAJARE INTERIOARA MAGAZIN IN STATIE DE DISTRIBUTIE CARBURANT „ROMPETROL” (RECOMPARTIMENTARE MAGAZIN, REFACERE FINISAJE, RECONFIGURAREA INSTALATIILOR INTERIOARE, ORGANIZAREA EXECUTIEI"
2017;1357;4-10-2017;04-10-2017;365090;08-08-2017;;construire;locuinte unifamiliale-cuplate,imprejmuire;"judetul Cluj, Janos Zsigmond, nr. 5";"Construire locuinta cu doua unitati locative P+E+Er-in regim cuplat, imprejmuire"
2017;1358;4-10-2017;04-10-2017;365095;08-08-2017;;construire;locuinte unifamiliale-cuplate,imprejmuire;"judetul Cluj, Janos Zsigmond, nr. 7";"Construire locuinta cu doua unitati locative P+E+Er-in regim cuplat, imprejmuire"
2017;1359;4-10-2017;04-10-2017;373166;16-08-2017;;bransare;;"judetul Cluj, Primaverii, nr. 28, bl. 1-3";"BRANSAMENT SI POST REGLARE-MASURARE GAZE NATURALE DE PRESIUNE REDUSA"
2017;1360;4-10-2017;04-10-2017;390534;29-08-2017;;bransare;;"judetul Cluj, Voronet, nr. 72";"BRANSAMENT SI POST REGLARE-MASURARE GAZE NATURALE DE PRESIUNE REDUSA"
2017;1361;9-10-2017;09-10-2017;429709;21-09-2017;;bransare;;"judetul Cluj, Strada Moricz Zsigmond, nr. 32";"Bransament gaze naturale"
2017;1362;9-10-2017;09-10-2017;373143;16-08-2017;PARTER;construire,continuare lucrari,amenajare;locuinte unifamiliale-izolate,imprejmuire,amenajari exterioare;"judetul Cluj, DONATH, nr. 270";"CONTINUARE LUCRARI FARA MODIFICAREA SOLUTIEI CONSTRUCTIVE AUTORIZATE INITIAL CU AC NR.1186 DIN 20.09.2012 PENTRU „CONSTRUIRE CASA UNIFAMILIALA PARTER, IMPREJMUIRE SI AMENAJARI EXTERIOARE”"
2017;1363;9-10-2017;17-08-2017;413863;12-09-2017;P;etajare,modificari interioare;;"judetul Cluj, Bul 21 Decembrie 1989, nr. 100";"MODIFICARI INTERIOARE SI MANSARDARE IMOBIL conform P.U.D. aprobat cu H.C.L. nr.740 din 18.06.2017"
2017;1364;9-10-2017;28-09-2017;390383;29-08-2017;;construire;locuinte colective;"judetul Cluj, Piața Abator  nr. 4-7 bl.B apt. 31";"BRANȘAMENT ELECTRIC  TRIFAZAT – SPOR DE PUTERE – APARTAMENT."
2017;1365;9-10-2017;28-09-2017;417294;14-09-2017;;extindere,bransare;;"judetul Cluj, SAFIRULUI  NR. 1,3,5";"EXTINDERE  CONDUCTA  GAZ DE PRESIUNE REDUSA  ȘI 3 BRANSAMENTE   DE GAZE NATURALE DE PRESIUNE REDUSA ( in montaj subteran) ,   3  P.R."
2017;1366;9-10-2017;28-09-2017;424459;19-09-2017;;bransare;;"judetul Cluj, Borhanciului  nr. 38 prov.";"ALIMENTARE CU ENERGIE ELECTRICA IMOBIL ( branșament electric în montaj subteran)."
2017;1367;9-10-2017;28-09-2017;425011;19-09-2017;;bransare;;"judetul Cluj, GALAȚI  NR. 30 PROV.";"BRANSAMENT  APĂ ȘI  RACORD CANAL MENAJER  ."
2017;1368;9-10-2017;27-09-2017;418238;14-09-2017;S+P+E;construire,amenajare;locuinte unifamiliale-izolate,locuinte colective,amenajari exterioare;"judetul Cluj, B-dul 1 Decembrie 1918, nr. 33";"LOCUINTA SEMICOLECTIVA CU 2 APARTAMENTE, REGIM DE INALTIME S+P+E, S+P+E+Er, AMENAJARI EXTERIOARE."
2017;1369;9-10-2017;04-10-2017;436809;26-09-2017;;bransare;;"judetul Cluj, EDGAR QUINET  NR.17";"BRANSAMENT DE APA SI 2  RACORDURI CANAL MENAJER."
2017;1370;9-10-2017;02-10-2017;407490;07-09-2017;;bransare;;"judetul Cluj, Sperantei, nr. 17F";"BRANSAMENT GAZE NATURALE"
2017;1371;9-10-2017;29-09-2017;411433;11-09-2017;;bransare;;"judetul Cluj, Voronet, nr. 76";"BRANSAMENT SI POST DE REGLARE MASURARE GAZE NATURALE DE PRESIUNE REDUSA"
2017;1372;9-10-2017;09-10-2017;387906;28-08-2017;;amplasare;;"judetul Cluj, Bucuresti, nr. 89, ap. 55-B";"AMPLASARE FIRMA PE FATADA IMOBILULUI"
2017;1373;9-10-2017;09-10-2017;409570;08-09-2017;;bransare;;"judetul Cluj, Paunului, nr. 3";"BRANSAMENT APĂ SI RACOD CANAL."
2017;1374;9-10-2017;09-10-2017;407579;07-09-2017;;extindere,reparatie;locuinte unifamiliale-izolate,acoperis;"judetul Cluj, Pripor, nr. 1";"REPARATII SARPANTA, INLOCUIRE INVELITOARE SI EXTINDERE CASA DE LOCUIT"
2017;1375;9-10-2017;09-10-2017;415997;13-09-2017;;bransare;;"judetul Cluj, Zarandului, nr. 15";"BRANSAMENT SI POST REGLARE-MASURARE GAZE NATURALE DE PRESIUNE REDUSA"
2017;1376;9-10-2017;09-10-2017;402837;06-09-2017;;extindere,etajare;locuinte unifamiliale-izolate;"judetul Cluj, Strada Plevnei, nr. 119";"EXTINDERE, MANSARDARE SI TRANSFORMARE LOCUINTA EXISTENTA IN LOCUINTA SEMICOLECTIVA CU DOUA UNITATI LOCATIVE"
2017;1377;10-10-2017;06-10-2017;444392;29-09-2017;;amplasare;;"judetul Cluj, Strada Mehedinti, nr. 66-68";"AMPLASARE PLATFORMA SUBTERANA PENTRU COLECTAREA SELECTIVA A DESEURILOR MENAJERE"
2017;1378;10-10-2017;06-10-2017;444402;29-09-2017;;amplasare;;"judetul Cluj, Alee Vidraru, nr. 13-15";"AMPLASARE PLATFORMA SUBTERANA PENTRU COLECTAREA SELECTIVA A DESEURILOR MENAJERE"
2017;1379;10-10-2017;06-10-2017;444399;29-09-2017;;amplasare;;"judetul Cluj, Strada Observatorului, nr. 19-21";"AMPLASARE PLATFORMA SUBTERANA PENTRU COLECTAREA SELECTIVA A DESEURILOR MENAJERE"
2017;1380;10-10-2017;06-10-2017;444407;29-09-2017;;amplasare;;"judetul Cluj, Strada Observatorului, nr. 105";"AMPLASARE PLATFORMA SUBTERANA PENTRU COLECTAREA SELECTIVA A DESEURILOR MENAJERE"
2017;1381;10-10-2017;06-10-2017;444390;29-09-2017;;amplasare;;"judetul Cluj, municipiul Cluj-Napoca, Strada Lunii, nr. 1-2-3-5";"AMPLASARE PLATFORME SUBTERANE PENTRU COLECTAREA SELECTIVA A DESEURILOR MENAJERE"
2017;1382;10-10-2017;06-10-2017;444391;29-09-2017;;amplasare;;"judetul Cluj, municipiul Cluj-Napoca, Alee Borsa, nr. 5";"AMPLASARE PLATFORME SUBTERANE PENTRU COLECTAREA SELECTIVA A DESEURILOR MENAJERE"
2017;1383;10-10-2017;06-10-2017;444397;29-09-2017;;amplasare;;"judetul Cluj, municipiul Cluj-Napoca, Calea Turzii ; Jupiter, nr. 122";"AMPLASARE PLATFORME SUBTERANE PENTRU COLECTAREA SELECTIVA A DESEURILOR MENAJERE"
2017;1384;10-10-2017;10-10-2017;243981;23-05-2017;D+P+E;modificari interioare,modificare solutie,continuare lucrari,amenajare,amplasare;locuinte unifamiliale-izolate,imprejmuire,amenajari exterioare;"judetul Cluj, Dariu pop, nr. 1";"CONTINUARE LUCRARI CU MODIFICARE SOLUTIE CONSTRUCTIVA LA AC 669/03.06.2013-CASA DE VACANTA D+P+E, IMPREJMUIRE, AMENAJARI EXTERIOARE Modificari: realizare piscina, modificari interioare si la fatade, corectare amplasare pe parcela pe latura N-E"
2017;1385;10-10-2017;06-10-2017;444394;29-09-2017;;amplasare;;"judetul Cluj, municipiul Cluj-Napoca, Bulevard Titulescu Nicolae, nr. 32";"AMPLASARE PLATFORME SUBTERANE PENTRU COLECTAREA SELECTIVA A DESEURILOR MENAJERE"
2017;1386;10-10-2017;10-10-2017;393644;31-08-2017;Dp+P+M;construire;locuinte unifamiliale-izolate;"judetul Cluj, Catinei, nr. 4";"CASA UNIFAMILIALA CU REGIM DE INALTIME Dp+P+M – intrare in legalitate conform procesului verbal de constatare si sanctionare a contraventiilor nr.1278/28.04.2016 intocmit de I.S.C."
2017;1387;10-10-2017;06-10-2017;444396;29-09-2017;;amplasare;;"judetul Cluj, municipiul Cluj-Napoca, Strada Mehedinti, nr. 58-60";"AMPLASARE PLATFORME SUBTERANE PENTRU COLECTAREA SELECTIVA A DESEURILOR MENAJERE"
2017;1388;10-10-2017;27-09-2017;404080;06-09-2017;D+P+M;construire,amenajare;locuinte unifamiliale-izolate,imprejmuire,amenajari exterioare;"judetul Cluj, Strada Vuia Romulus, nr. 177";"CASA UNIFAMILIALA D+P+M, IMPREJMUIRE SI AMENAJARI EXTERIOARE"
2017;1389;10-10-2017;10-10-2017;376626;18-08-2017;S+P+6E+Et;construire,amenajare,cercetare;imprejmuire,amenajari exterioare;"judetul Cluj, Strada Somesului, nr. 14";"„CONSTRUIRE CENTRU DE CERCETARE, FAZA 1 DE DEZVOLTARE, CLADIRE CU FUNCTIUNI MIXTE SI PARCAJ SUBTERAN S+P+6E+Et, AMENAJARI EXTERIOARE, IMPREJMUIRE TEREN, ORGANIZARE DE SANTIER.   In urmatoarele conditii: Se interzice modificarea parcelarului pana la receptionarea lucrarilor si eliberarea certificatului de atestare a edificarii constructiei."
2017;1390;10-10-2017;10-10-2017;424131;19-09-2017;P+E;construire;locuinte unifamiliale-izolate,imprejmuire;"judetul Cluj, Strada Oasului, nr. 353";"locuinta semicolectiva cu doua unitati locative,imprejmuire teren,microstatie de epurare  Regimul de inalt.P+E"
2017;1391;11-10-2017;11-10-2017;399914;04-09-2017;;bransare;;"judetul Cluj, Pintea Viteazul, nr. 3A";"aBRANSAMENT APA si RACORD CANAL"
2017;1392;11-10-2017;11-10-2017;392015;30-08-2017;;construire;;"judetul Cluj, Horea,, nr. 1";"INTERVENTIE PENTRU REABILITAREA STRUCTURAL ARHITECTURALA A UNUI IMOBIL CONF .HCL 298/03.09.2015-Ansamblu urban centrul istoric al orasului Cluj-Napoca"
2017;1393;11-10-2017;11-10-2017;397460;01-09-2017;;construire,renovare,modificare solutie,consolidare,schimbare destinatie;locuinte unifamiliale-izolate,locuinte colective,acoperis;"judetul Cluj, Virgil Fulicea , nr. 7, ap. 1";"Modificarea solutiei constructive autorizate cu nr. 1480-14.11.2013-Consolidare imobil,refacere sarpanta,renovare fatada,modificari si construire scara interioara din apartament pentru acces in pod. Modificarile propuse;mofificari interioare,schimbare destinatie din locuinta ap.1 in spatiu de alimentatie publica."
2017;1394;11-10-2017;11-10-2017;367097;09-08-2017;P+8E;construire,modificare solutie,continuare lucrari,schimbare destinatie;birouri,comert,servicii,imprejmuire,spatii cazare;"judetul Cluj, CALEA TURZII, nr. 178K";"CONTINUARE LUCRARI CU MODIFICAREA SOLUTIEI CONSTRUCTIVE AUTORIZATA INITIAL CU AC NR.687 DIN 21.06.2011 PENTRU "CONSTRUIRE SPITAL P+8E”  MODIFICARI PROPUSE: SCHIMBARE DE DESTINATIE DIN SPITAL IN IMOBIL CU FUNCTIUNI MIXTE (BIROURI, COMERT, SERVICII HOTELIERE), IMPREJMUIRE TEREN"
2017;1395;12-10-2017;12-10-2017;426403;20-09-2017;;construire;;"judetul Cluj, Strada Frunzisului";"SENS GIRATORIU – STRADA FRUNZISULUI."
2017;1396;12-10-2017;06-10-2017;427853;20-09-2017;;extindere,bransare;;"judetul Cluj,  GRIGORE MOISIL NR. 24";"EXTINDERE  CONDUCTĂ DE  APĂ POTABILĂ , DE CANALIZARE MENAJERĂ  , EXTINDERE GAZ DE PRESIUNE REDUSĂ  , BRANSAMENT DE GAZE NATURALE DE PRESIUNE REDUSA ( in montaj subteran) ,P.R., BRANȘAMENT APĂ , RACORD CANAL MENAJER , ALIMENTARE CU ENERGIE ELECTRICĂ IMOBIL EXISTENT, REFACERE DRUM."
2017;1397;12-10-2017;03-10-2017;366306;09-08-2017;;bransare;;"judetul Cluj, Ghioceilor nr. 14";"BRANSAMENT DE GAZE NATURALE DE PRESIUNE REDUSA ( in montaj subteran) ,  P.R."
2017;1398;12-10-2017;04-10-2017;420365;15-09-2017;;bransare;;"judetul Cluj, VASILE STOICA NR. 16";"BRANSAMENT APĂ ȘI  RACORD CANAL MENAJER ."
2017;1399;12-10-2017;04-10-2017;436804;26-09-2017;;bransare;;"judetul Cluj, CÂMPULUI NR.327 PROVIZORIU";"2 BRANSAMENTE APĂ  ȘI  2 RACORDURI  CANAL MENAJER ."
2017;1400;12-10-2017;04-10-2017;436817;26-09-2017;;bransare;;"judetul Cluj, GRIGORE ANTIPA NR. 24";"BRANSAMENT APĂ  ȘI   RACORD  CANAL MENAJER ."
2017;1401;12-10-2017;12-10-2017;433151;25-09-2017;;construire;monument istoric;"judetul Cluj, AVRAM IANCU, nr. 18";"REABILITARE RESTAURARE LA CLADIRI REPREZENTAND MONUMENTE ISTORICE"
2017;1402;13-10-2017;04-10-2017;419218;15-09-2017;;bransare;;"judetul Cluj, Strada Ghioceilor, nr. 11";"BRANSAMENT DE GAZE NATURALE DE PRESIUNE REDUSA ( in montaj subteran) ,  P.R."
2017;1403;13-10-2017;13-10-2017;424270;19-09-2017;P;urgenta;;"judetul Cluj, Horea,, nr. 65";"INTERVENTIE DE PRIMA URGENTA IN VEDEREA PUNERII IN SIGURANTA A ELEMENTELOR SI PARTILOR DE CONSTRUCTIE CARE PREZINTA PERICOL PUBLIC LA IMOBILELE SITUATE IN „Ansamblul Urban-Centrul Istoric al orasului Cluj-Napoca”-Imobil str. Horea nr. 65 In urmatoarele conditii: Conform Legii nr.50/1991, republicata, art.7, alin.(16), proiectul pentru autorizarea executarii lucrarilor de constructii/desfiintare,. proiectul tehnic P.T, detaliile de executie D.E,- vor fi elaborate si aprobate pe parcursul sau la incheierea executarii lucrarilor, cu respectarea avizelor si acordurilor, precum si, dupa caz,a actului administrativ al autoritatii competente pentru protectia mediului."
2017;1404;16-10-2017;06-10-2017;444406;29-09-2017;;amplasare;;"judetul Cluj, Nicolae Titulescu, nr. 6";"AMPLASARE PLATFORME SUBTERANE PENTRU COLECTAREA SELECTIVA A DESEURILOR MENAJERE"
2017;1405;16-10-2017;06-10-2017;444395;29-09-2017;;construire;;"judetul Cluj, Strada Muncitorilor, nr. 8";"PENTRU COLECTAREA SELECTIVA A DESEURILOR MENAJERE"
2017;1406;16-10-2017;06-10-2017;444404;29-09-2017;;amplasare;;"judetul Cluj, Bulevard Titulescu Nicolae, nr. 14";"AMPLASARE PLATFORMA SUBTERANA PENTRU COLECTAREA SELECTIVA A DESEURILOR MENAJERE"
2017;1407;16-10-2017;21-09-2017;414842;13-09-2017;;modificari interioare,schimbare destinatie;locuinte unifamiliale-izolate,servicii;"judetul Cluj, Strada Universitatii, nr. 8, ap. 6";"SCHIMBARE DE DESTINATIE, FARA MODIFICARI INTERIOARE, DIN LOCUINTA IN SPATII PENTRU SERVICII CU ACCES PUBLIC"
2017;1408;16-10-2017;04-10-2017;422905;18-09-2017;;bransare;;"judetul Cluj, EUGEN IONESCO  NR. 73 provizoriu";"BRANSAMENT APĂ  ȘI   RACORD  CANAL MENAJER"
2017;1409;16-10-2017;04-10-2017;425360;19-09-2017;;extindere,bransare;;"judetul Cluj, ROMUL LADEA NR.53";"BRANSAMENT APĂ  ȘI EXTINDERE CANAL MENAJER INTERIOR."
2017;1410;16-10-2017;03-10-2017;433199;25-09-2017;;bransare;;"judetul Cluj, ZARANDULUI NR.14 E provizoriu";"BRANȘAMENT APĂ ȘI  RACORD  CANAL MENAJER  ."
2017;1411;16-10-2017;03-10-2017;433205;25-09-2017;;bransare;;"judetul Cluj, ZARANDULUI NR.14 D provizoriu";"BRANȘAMENT APĂ ȘI  RACORD  CANAL MENAJER  ."
2017;1412;16-10-2017;16-10-2017;403510;06-09-2017;;bransare;;"judetul Cluj, Dobrogei, nr. 1A,1B";"2 BRANSAMENTE GAZE NATURALE DE PRESIUNE REDUSA (in montaj subteran) SI P.R."
2017;1413;16-10-2017;11-10-2017;446895;02-10-2017;;bransare;;"judetul Cluj,  BÂRC I nr. 13A";"BRANSAMENT DE GAZE NATURALE DE PRESIUNE REDUSA ( in montaj subteran) ,  P.R."
2017;1414;16-10-2017;04-10-2017;444401;29-09-2017;;amplasare;;"judetul Cluj, municipiul Cluj-Napoca, Strada Mehedinti, nr. 42-44 46-48";"AMPLASARE PLATFORME SUBTERANE PENTRU COLECTAREA SELECTIVA A DESEURILOR MENAJERE"
2017;1415;18-10-2017;18-10-2017;454504;05-10-2017;;amenajare;amenajari interioare;"judetul Cluj, Calea Motilor, nr. 63, ap. 4";"AMENAJARI INTERIOARE, AP.4"
2017;1416;18-10-2017;18-10-2017;444233;29-09-2017;P+E;construire;locuinte unifamiliale-izolate;"judetul Cluj, ALEEA RECOLTEI, nr. 37";"LOCUINTA UNIFAMILIALA P+E"
2017;1417;18-10-2017;11-10-2017;449693;03-10-2017;;bransare;;"judetul Cluj, municipiul Cluj-Napoca, Ionescu de la Brad Ion, Strada, nr. 12B";"BRANSAMENT DE APA SI RACORD CANAL"
2017;1418;18-10-2017;18-10-2017;417346;14-09-2017;PARTER,S+P+E+R;construire,amenajare;locuinte unifamiliale-izolate,servicii,imprejmuire,amenajari exterioare;"judetul Cluj, MACINULUI, nr. 34";"CONSTRUIRE LOCUINTA SEMICOLECTIVA  CU DOUA UNITATI LOCATIVE SI SERVICII LA PARTER REGIM DE INALTIME S+P+E+R, IMPREJMUIRE SI AMENAJARI EXTERIOARE"
2017;1419;18-10-2017;10-10-2017;430433;21-09-2017;;construire;;"judetul Cluj, COJOCNEI NR.13";"REDIMENSIONARE BRANȘAMENT APĂ"
2017;1420;19-10-2017;04-10-2017;432053;22-09-2017;;schimbare destinatie;locuinte unifamiliale-izolate,comert,marcare;"judetul Cluj, Cale Motilor, nr. 64, ap. 1";"SCHIMBARE DE DESTINATIE AP.1 DIN LOCUINTA IN SPATIU COMERCIAL, DESCHIDERE ACCES DIN STRADA, AM_PLASARE FIRMA LUMINOASA PE FATADA"
2017;1421;20-10-2017;12-10-2017;452859;05-10-2017;;bransare;;"judetul Cluj, municipiul Cluj-Napoca, Remenyk Sandor, nr. 1D";"BRANSAMENT GAZ PRESIUNE REDUSA"
2017;1422;20-10-2017;20-10-2017;401540;05-09-2017;;construire,amenajare;locuinte unifamiliale-izolate,locuinte colective,amenajari exterioare;"judetul Cluj, Horticultorilor, nr. 3";"CONSTRUIRE  LOCUINTA SEMICOLECTICA CU DOUA APARTAMENTE, AMENAJARI EXTERIOARE, GARD LA STRADA, RACORDURI BRANSAMENTE LA UTILITATI"
2017;1423;20-10-2017;20-09-2017;394050;31-08-2017;;bransare;;"judetul Cluj, SEMENICULUI  nr.13";"BRANSAMENT APA , DERIVATIE DE BRANSAMENT DE APA SI RACORD CANAL"
2017;1424;20-10-2017;04-10-2017;421575;18-09-2017;;extindere,bransare;;"judetul Cluj, VASILE VELICAN NR.2";"EXTINDERE  CONDUCTĂ  APĂ  POTABILĂ ,  BRANSAMENT APĂ ȘI REFACERE DRUM."
