year;index;data-afisare;data-creare;data-cerere;nr.cerere;regim-h;actiune;tip-lucrari;adresa;titlu
2017;476;26-04-2017;08-03-2017;90631;22-02-2017;S+P+E;construire,amenajare;locuinte unifamiliale-izolate,imprejmuire,amenajari exterioare;"judetul Cluj, Voievodul Menumorut,Strada, nr. 14 pr";"LOCUINTA SEMICOLECTIVA CU DOUA UNITATI LOCATIVE S+P+E, ÎMPREJMUIRE, AMENAJARI EXTERIOARE. In urmatoarele conditii:  Se interzice modificarea parcelarului pana la receptionarea lucrarilor si eliberarea certificatului de atestare a edificarii constructiei; pana la finalizarea lucrarilor drumul de acces se va realiza la strat de uzura."
2017;477;28-04-2017;18-04-2017;171249;06-04-2017;;extindere;locuinte colective,balcon;"judetul Cluj, Alee Baita, nr. 7, bl. k3, sc. 5, et. p, ap. 47";"BALCON LA APARTAMENTUL NR.47."
2017;478;28-04-2017;07-04-2017;161085;31-03-2017;D+P+M;continuare lucrari,amenajare;locuinte unifamiliale-izolate,locuinte colective,imprejmuire,amenajari exterioare;"judetul Cluj, Strada Viile Nadasel, nr. 44";"CONTINUARE DE LUCRARI FARA MODIFICARE DE SOLUTIE LA LOCUINTA CU 2 APARTAMENTE CU REGIM DE INALTIME D+P+M, IMPREJMUIRE SI AMENAJARI EXTERIOARE AUTORIZATE CU A.C. NR.1447 DIN 22.11.2012   In urmatoarele conditii:  Se interzice modificarea parcelarului pana la receptionarea lucrarilor si eliberarea certificatului de atestare a edificarii constructiei."
2017;479;28-04-2017;28-04-2017;139362;21-03-2017;;construire,modificari interioare;locuinte colective;"judetul Cluj, municipiul Cluj-Napoca, Titulescu Nicolae, Bulevard, nr. 43, ap. 32";"CONSTRUIRE DOUĂ BALCOANE LA PARTERUL BLOCULUI ȘI MODIFICĂRI INTERIOARE AFERENTE APARTAMENTULUI 32"
2017;480;28-04-2017;28-04-2017;158264;30-03-2017;;construire,extindere,modificari interioare;balcon;"judetul Cluj, Strada Primaverii, nr. 6, ap. 306";"Modificari interioare si construirea unui balcon la parterul blocului"
2017;481;28-04-2017;18-04-2017;145280;23-03-2017;S+P+E;construire,amenajare;locuinte unifamiliale-izolate,imprejmuire,amenajari exterioare;"judetul Cluj, Strada Cometei, nr. 44";"CASĂ UNIFAMILIALĂ S+P+E, ÎMPREJMUIRE, AMENAJARI EXTERIOARE. In urmatoarele conditii:  Se interzice modificarea parcelarului pana la receptionarea lucrarilor si eliberarea certificatului de atestare a edificarii constructiei."
2017;482;28-04-2017;28-04-2017;158710;30-03-2017;S+P+2E,S+D+P+4E;modificare solutie,continuare lucrari,amenajare;amenajari exterioare,amenajari interioare;"judetul Cluj, Strada Bisericii Sfântul Toma, nr. 2";"CONTINUARE LUCRARI CU MODIFICARE SOLUTIE CONSTRUCTIVA LA AC 1254/19.10.2011-FACULTATEA DE TEOLOGIE ORTODOXA S+P+2E la 4E, CAMIN STUDENTESC S+D+P+4E la 8E, AMENAJARI EXTERIOARE Modificari: modificari, recompartimentari inerioare, amenajari exterioare cu asigurarea a 12 locuri de parcare la subsol caminului studentesc si 56 locuri de parcare la sol"
2017;483;28-04-2017;21-04-2017;170797;06-04-2017;P+E+M;construire,amenajare;locuinte unifamiliale-izolate,imprejmuire,amenajari exterioare;"judetul Cluj, Zavoiului nr 3A";"LOCUINTA SEMICOLECTIVA CU 2 UNITATI LOCATIVE P+E+M, IMPREJMUIRE SI AMENAJARI EXTERIOARE"
2017;484;28-04-2017;28-04-2017;178996;11-04-2017;D+P+E;modificare solutie,amenajare;locuinte unifamiliale-cuplate,amenajari exterioare;"judetul Cluj, Freziei nr 7";"MODIFICARE SOLUTIE AUTORIZATA CU AC nr. 270 din 21.03.2008 RESPECTIV 535 din 13.05.2016 pentru Corp 2 LOCUINTA UNIFAMILIALA CU REGIM DE INALTIME D+P+E SI AMENAJARI EXTERIOARE Nota: Lucrarile se afla in executie si au fost autorizate initial cu AC nr.  270 din 21.03.2008 respectiv AC nr. 535 din 13.05.2016"
2017;485;2-05-2017;02-05-2017;163711;03-04-2017;S+P+5E+R,PARTER;construire,amenajare;locuinte colective,imprejmuire,amenajari exterioare;"judetul Cluj, Alexandru VAIDA VOEVOD, nr. 14";"CONSTRUIRE IMOBIL MIXT S+P+5E+R – LOCUINTE COLECTIVE SI PARTER  SPATIU PENTRU ACTIVITATI TERTIARE, IMPREJMUIRE SI AMENAJARI EXTERIOARE"
2017;486;3-05-2017;13-04-2017;178625;11-04-2017;;bransare;;"judetul Cluj, SFÂNTA VINERI NR. 8";"BRANSAMENT DE GAZE NATURALE DE PRESIUNE REDUSA ( in montaj subteran   ) ,  P.R."
2017;487;3-05-2017;03-05-2017;132032;16-03-2017;;amplasare;marcare;"judetul Cluj, Strada Bucegi, nr. 19, bl. I, et. parter";"MONTARE DOUA FIRME LUMINOASE PE FATADA. In urmatoarele conditii:  Firmele se vor realiza fara lumina intermitenta. Durata de existenta firma: Pe perioada Contractului de inchiriere nr.1253/22.12.2016."
2017;488;3-05-2017;19-04-2017;138097;20-03-2017;;extindere,bransare,amenajare;;"judetul Cluj, Strada Buna Ziua, nr. FN";"AMENAJARE DRUM DE ACCES ( conform PUZ aprobat cu HCL nr. 10 din 11.01.2016), EXTINDERE  REȚELE DE APĂ-CANAL MENAJER, GAZE NATURALE , ELECTRICE, TELEFONIE ȘI CATV ."
2017;489;3-05-2017;03-05-2017;144970;23-03-2017;;amplasare;marcare;"judetul Cluj, Calea floresti, nr. 56a";"AMPLASARE FIRMA LUMINOASA , MODIFICARE FATADE EXISTENTE SI MODIFICARE AFISAJ PUBLICITAR PE TOTEM EXISTENT"
2017;490;4-05-2017;04-05-2017;155564;29-03-2017;;bransare;;"judetul Cluj, Lombului și Spicului.";"INLOCUIRE CONDUCTE DE GAZE NATURALE DE   PRESIUNE REDUSĂ     SI  BRANSAMENTE  DE GAZE NATURALE DE    PRESIUNE  REDUSĂ  ( in montaj subteran) pe străzile: Lombului și Spicului."
2017;491;4-05-2017;13-04-2017;167577;05-04-2017;;bransare;;"judetul Cluj, Dunării nr. 131 Corp 1 și 2";"REDIMENSIONARE BRANȘAMENT APĂ, DERIVAȚIE DE BRANȘAMENT APĂ    DERIVAȚIE RACORD CANAL MENAJER ȘI BRANȘAMENT ELECTRIC ( în montaj subteran)."
2017;492;4-05-2017;18-04-2017;168587;05-04-2017;;construire;;"judetul Cluj, Voievodul Gelu nr. 28 H";"BRANȘAMENT APĂ"
2017;493;4-05-2017;18-04-2017;169370;06-04-2017;;construire;;"judetul Cluj, Strada Vaida Voevod Alexandru, nr. 53";"RACORD CANAL MENAJER."
2017;494;4-05-2017;18-04-2017;170014;06-04-2017;;bransare;;"judetul Cluj, ZARANDULUI  NR.16C";"BRANSAMENT APA SI RACORD CANAL"
2017;495;4-05-2017;18-04-2017;170025;06-04-2017;;bransare;;"judetul Cluj, ZARANDULUI  NR.14C";"BRANȘAMENT APĂ ȘI RACORD CANAL MENAJER ."
2017;496;4-05-2017;19-04-2017;174936;10-04-2017;;bransare;;"judetul Cluj, Strada Borhanciului, nr. 45C";"BRANSAMENT DE GAZE NATURALE DE PRESIUNE REDUSA ( in montaj subteran) ,  P.R."
2017;497;4-05-2017;19-04-2017;174958;10-04-2017;;bransare;;"judetul Cluj, OAȘULUI  nr. 334";"BRANSAMENT DE GAZE NATURALE DE PRESIUNE REDUSA ( in montaj subteran) ,  P.R."
2017;498;4-05-2017;19-04-2017;174963;10-04-2017;;bransare;;"judetul Cluj, Dunării  nr. 131";"BRANSAMENT DE GAZE NATURALE DE PRESIUNE REDUSA ( in montaj subteran) ,  P.R."
2017;499;4-05-2017;04-05-2017;175435;10-04-2017;;bransare;;"judetul Cluj, SMÂRDAN NR.10-12";"BRANȘAMENT APĂ , DERIVAȚIE BRANȘAMENT APĂ   ȘI DOUĂ  RACORDURI  CANAL MENAJER."
2017;500;4-05-2017;27-04-2017;184206;13-04-2017;;construire;;"judetul Cluj, Busuiocului nr.35A";"BRANȘAMENT ELECTRIC ( în montaj subteran)."
2017;501;4-05-2017;25-04-2017;184215;13-04-2017;;bransare;;"judetul Cluj, Aleea Cisnădie nr. 2 provizoriu";"BRANSAMENT DE GAZE NATURALE DE PRESIUNE REDUSA ( in montaj subteran) ,  P.R."
2017;502;4-05-2017;24-04-2017;189505;20-04-2017;;bransare;;"judetul Cluj, ZARANDULUI  nr. 16 provizoriu";"BRANSAMENT APA SI RACORD CANAL"
2017;503;4-05-2017;24-04-2017;190610;20-04-2017;;bransare;;"judetul Cluj, Strada Câmpina, nr. 47";"BRANȘAMENT DE GAZE NATURALE DE PRESIUNE REDUSA ( in montaj subteran) ,  P.R."
2017;504;4-05-2017;27-04-2017;192184;21-04-2017;;bransare;;"judetul Cluj, OLEANDRULUI  NR. 28";"BRANȘAMENT APĂ   ȘI   RACORD  CANAL MENAJER."
2017;505;4-05-2017;24-04-2017;192633;21-04-2017;;bransare;;"judetul Cluj, CUCULUI NR. 5";"BRANSAMENT DE GAZE NATURALE DE PRESIUNE REDUSA ( in montaj subteran) ,  P.R."
2017;506;4-05-2017;04-05-2017;157376;30-03-2017;S+P+E+M,S+P+E;modificari interioare;locuinte colective,acoperis;"judetul Cluj, Strada Rosetti C.A., nr. 23B pr";"MODIF PE PARCURSUL EXEC PENTRU LUCRARI DE CONSTR 3 IMOBILE DE LOCUIT TIP VILA URBANA S+P+E+M CU 3 AP FIECARE, AM EXT, AUT CU A.C. nr.1314/04.11.2015. Modificarile propuse: coborarea cotei+-0,00, modificari interioare si fatade la toate corpurile;  modificare acoperis, regim de inaltime in S+P+E si realizarea a cate 2 apartamente la corpurile C1 si C2, se incadreaza in limitele avizelor si acordurilor obtinute."
2017;507;4-05-2017;04-05-2017;143003;22-03-2017;;amenajare;terasa sezoniera;"judetul Cluj, Alee Peana, nr. 18";"AMENAJARE TERASA SEZONIERA IN SISTEM PROVIZORIU SI DEMONTABIL DURATA DE EXISTENTA: PANA LA 31.10.2017 INVESTITOR: SC TOBIAS CAFFE SRL"
2017;508;4-05-2017;04-05-2017;183946;13-04-2017;S+P+E;modificari interioare,continuare lucrari,amenajare;locuinte unifamiliale-izolate,imprejmuire,acoperis,amenajari exterioare;"judetul Cluj, Strada Gaudi Antonio, nr. 43";"CONTINUARE CU MODIFICARE LUCRARI AUT CU A.C. nr.1244/02.08.2007 PENTRU CONSTR CASĂ FAM CU REGIM DE ÎNĂLŢIME S+P+E ŞI ÎMPREJMUIRE PROP. Modificarile propuse: modificari interioare pentru realizarea a doua unitati locative, inchiderea si acoperirea terasei de la etaj, modificare goluri la fatade, modificare imprejmuire si amenajari exterioare, se incadreaza in limitele avizelor si acordurilor obtinute."
2017;509;4-05-2017;04-05-2017;146490;24-03-2017;Dp+P+M;extindere,etajare,amenajare;locuinte unifamiliale-izolate,amenajari exterioare;"judetul Cluj, Strada Doja Gheorghe, nr. 45";"EXTINDERE SI MANSARDARE LOCUINTA UNIFAMILIALA CU REGIm FINAL DE INALTIME Dp+P+M, AMENAJARI EXTERIOARE"
2017;510;4-05-2017;04-05-2017;153697;28-03-2017;P+E;construire;imprejmuire,amenajari exterioare;"judetul Cluj, municipiul Cluj-Napoca, Strada Neculce Ion, nr. 2";"LOCUINȚĂ COLECTIVĂ CU 2 UNITĂȚI LOCATIVE P+E AMENAJĂRI EXTERIOARE ȘI ÎMPREJMUIRE"
2017;511;4-05-2017;28-04-2017;147783;24-03-2017;;reparatie;;"judetul Cluj, Strada Fânatelor";"REPARATII SI INTRETINERE STR. FANATELOR"
2017;512;4-05-2017;28-04-2017;147790;24-03-2017;;reparatie;;"judetul Cluj, Strada Artelor";"reparatii si itnretinere str. Artelor"
2017;513;4-05-2017;04-05-2017;151703;28-03-2017;;bransare;;"judetul Cluj, municipiul Cluj-Napoca, Oleandrului, Strada, nr. 8";"BRANȘAMENT GAZE NATURALE PRESIUNE REDUSĂ ÎN MONTAJ SUBTERAN ȘI P.R.M."
2017;514;4-05-2017;04-05-2017;115904;07-03-2017;;etajare,modificari interioare;;"judetul Cluj, municipiul Cluj-Napoca, Strada Gutenberg Johannes, nr. 5B";"MANSARDARE CONSTRUCȚIE EXISTENTĂ, ÎNCHIDERE TERASĂ, MODIFICĂRI INTERIOARE ȘI EXTERIOARE"
2017;515;4-05-2017;04-05-2017;191053;20-04-2017;;amplasare;;"judetul Cluj,  CALEA FLOREȘTI  F.N.";"ÎNLOCUIRE INDICATOARE DE INTRARE, RESPECTIV IEȘIRE DIN LOCALITATE ȘI AMPLASARE PANOURI INFORMATIVE ."
2017;516;4-05-2017;31-03-2017;122715;10-03-2017;S+P+E;construire,amenajare;locuinte unifamiliale-izolate,imprejmuire,amenajari exterioare;"judetul Cluj, municipiul Cluj-Napoca, Strada Caransebes, nr. 14";"CONSTRUIRE LOCUINTA UNIFAMILIALA CU REGIM DE INALTIME S+P+E, IMPREJMUIRE, AMENAJARI EXTERIOARE"
2017;517;4-05-2017;04-05-2017;186460;18-04-2017;;construire,etajare;;"judetul Cluj, Campului fn";"SUPRAETAJARE CORP C2 SI CONSTRUIRE LIFT EXTERIOR"
2017;518;5-05-2017;05-05-2017;195496;24-04-2017;;construire;acoperis;"judetul Cluj, Johhanes Gutenberg nr 5A";"MODIFICARE ACOPERIS"
2017;519;8-05-2017;08-05-2017;200195;26-04-2017;;extindere,reparatie;;"judetul Cluj, Clinicilor nr 34";"REPARATII IMOBIL-FATADA, INSTALATII INTERIOARE, EXTINDERE MANSARDA EXISTENTA IN POD"
2017;520;8-05-2017;08-05-2017;198134;25-04-2017;Sp+P+E;construire,amenajare;locuinte unifamiliale-izolate,imprejmuire,amenajari exterioare;"judetul Cluj, Ulmului nr 5";"LOCUINTA SEMICOLECTIVA CU 2 UNITATI LOCATIVE Sp+P+E, IMPREJMUIRE SI AMENAJARI EXTERIOARE In urmatoarele conditii:  Se interzice modificarea parcelarului pana la receptionarea lucrarilor si eliberarea certificatului de atestare a edificarii constructiei."
2017;521;8-05-2017;08-05-2017;190877;20-04-2017;P+E;construire;locuinte unifamiliale-cuplate,imprejmuire;"judetul Cluj, municipiul Cluj-Napoca, Recoltei, Strada, nr. 26";"CONSTRUIRE LOCUINȚĂ FAMILIALĂ ÎN REGIM CUPLAT P+E ȘI  ÎMPREJMUIRE TEREN"
2017;522;8-05-2017;08-05-2017;538734;27-12-2016;;construire,amenajare;locuinte unifamiliale-izolate,amenajari exterioare;"judetul Cluj, CB.P. Hasdeu, nr. 103";"LOCUINTA CU DOUA UNITATI  LOCATIVE S+P+E+Er, SISTEMATIZARE VERTICALA SI AMENAJARI EXTERIOARE"
2017;523;8-05-2017;08-05-2017;148954;27-03-2017;Sp+P+E;construire;locuinte unifamiliale-izolate,imprejmuire,amenajari exterioare;"judetul Cluj, municipiul Cluj-Napoca, Strada Odobesti, nr. 16";"CONSTRUIRE LOCUINȚĂ UNIFAMILIALĂ Sp+P+E, ÎMPREJMUIRE ȘI AMENAJĂRI EXTERIOARE"
2017;524;8-05-2017;08-05-2017;162163;03-04-2017;P+E;etajare,modernizare;locuinte unifamiliale-izolate;"judetul Cluj, municipiul Cluj-Napoca, Strada Brutarilor, nr. 11";"MODERNIZARE ȘI ETAJARE CASĂ UNIFAMILIALĂ CU REGIM FINAL DE ÎNĂLȚIME P+E"
2017;525;8-05-2017;08-05-2017;117907;08-03-2017;P+E;construire;locuinte unifamiliale-izolate,amenajari exterioare;"judetul Cluj, municipiul Cluj-Napoca, Valea Seaca, Strada, nr. 15D";"CONSTRUIRE LOCUINTĂ UNIFAMILIALĂ P+E ȘI AMENAJĂRI EXTERIOARE (C2)"
2017;526;8-05-2017;08-05-2017;117905;08-03-2017;P+E;construire;locuinte unifamiliale-izolate,imprejmuire,amenajari exterioare;"judetul Cluj, municipiul Cluj-Napoca, Strada Valea Seaca, nr. 15D";"CONSTRUIRE LOCUINTĂ UNIFAMILIALĂ P+E ÎMPREJMUIRE ȘI AMENAJĂRI EXTERIOARE (C1)"
2017;527;8-05-2017;08-05-2017;151836;28-03-2017;Sp+P+E;construire,amenajare;locuinte unifamiliale-izolate,imprejmuire,amenajari exterioare;"judetul Cluj, Dobrogei nr 1B provizoriu";"LOCUINTA FAMLIALA CU DOUA UNITATI LOCATIVE, IMPREJMUIRE SI AMENAJARI EXTERIOARE REGIM DE INALTIME:Sp+P+E"
2017;528;10-05-2017;24-04-2017;185057;14-04-2017;;bransare;;"judetul Cluj, FÂNAȚELOR nr. 13M";"BRANSAMENT DE GAZE NATURALE DE PRESIUNE REDUSA ( in montaj subteran) ,  P.R."
2017;529;10-05-2017;24-04-2017;185063;14-04-2017;;bransare;;"judetul Cluj,  D.D.ROȘCA nr. 6";"BRANSAMENT DE GAZE NATURALE DE PRESIUNE REDUSA ( in montaj subteran) ,  P.R."
2017;530;10-05-2017;24-04-2017;185076;14-04-2017;;bransare;;"judetul Cluj,  CALEA TURZII  NR. 192E";"BRANSAMENT DE GAZE NATURALE DE PRESIUNE REDUSA ( in montaj subteran) ,  P.R."
2017;531;10-05-2017;24-04-2017;191511;21-04-2017;;extindere;;"judetul Cluj, Soporului";"EXTINDERE REȚEA ELECTRICĂ 0,4KV ( în montaj subteran)."
2017;532;10-05-2017;10-05-2017;192660;21-04-2017;;bransare;;"judetul Cluj,  VORONEȚ NR. 83 provizoriu";"BRANSAMENT DE GAZE NATURALE DE PRESIUNE REDUSA ( in montaj subteran) ,  P.R."
2017;533;10-05-2017;10-05-2017;192680;21-04-2017;;bransare;;"judetul Cluj, ANTIM IVIREANU NR.1-3";"BRANSAMENT DE GAZE NATURALE DE PRESIUNE REDUSA ( in montaj subteran) ,  P.R."
2017;534;10-05-2017;28-04-2017;198963;26-04-2017;;bransare;;"judetul Cluj, CALEA TURZII NR.192";"BRANȘAMENT APĂ ȘI RACORD CANAL MENAJER ."
2017;535;10-05-2017;28-04-2017;199993;26-04-2017;;extindere,bransare;;"judetul Cluj, BORHANCIULUI NR.112 provizoriu";"BRANȘAMENT APĂ , DERIVAȚIE BRANȘAMENT APĂ , RACORD  CANAL MENAJER ȘI EXTINDERE RACORD CANAL MANAJER."
2017;536;10-05-2017;28-04-2017;200120;26-04-2017;;bransare;;"judetul Cluj, VORONEȚ NR.76D";"BRANSAMENT DE GAZE NATURALE DE PRESIUNE REDUSA ( in montaj subteran) ,  P.R."
2017;537;10-05-2017;10-05-2017;145129;23-03-2017;;amenajare;terasa sezoniera;"judetul Cluj, Cale Floresti, nr. 24B";"REAMENAJARE TERASa SEZONIERA IN SISTEM PROVIZORIU SI DEMONTABIL DURATA DE EXISTENTA: PANA LA 31.10.2017 INVESTITOR: FARCAS CIPRIAN"
2017;538;10-05-2017;27-04-2017;190600;20-04-2017;;bransare;;"judetul Cluj, Take Ionescu, nr. 34";"BRANSAMENT DE GAZE NATURALE DE PRESIUNE REDUSĂ ( in montaj subteran ) si P.R."
2017;539;10-05-2017;27-04-2017;190613;20-04-2017;;bransare;;"judetul Cluj, Strada Iasomiei, nr. 27";"BRANSAMENT DE GAZE NATURALE DE PRESIUNE REDUSĂ ( in montaj subteran ) si P.R."
2017;540;10-05-2017;28-04-2017;196412;25-04-2017;;bransare;;"judetul Cluj,   Cetății, C.A.Rosetti și Călărașilor";"INLOCUIRE CONDUCTE SI BRANSAMENTE GAZ PRESIUNE REDUSA PE STRAZILE CETATII, C.A ,ROSETTI CALARASILOR"
2017;541;11-05-2017;11-05-2017;172220;07-04-2017;;bransare;;"judetul Cluj, municipiul Cluj-Napoca, Strada Rapsodiei, nr. 4A";"BRANSAMENT APA ȘI RACORD CANAL"
2017;542;11-05-2017;11-05-2017;190734;20-04-2017;;bransare;;"judetul Cluj, municipiul Cluj-Napoca, Voronet, Strada, nr. 83 PROV";"BRANSAMENT DE APA SI RACORD CANAL"
2017;543;11-05-2017;11-05-2017;200464;20-04-2017;P+E+M;construire,amenajare;locuinte unifamiliale-cuplate,imprejmuire,amenajari exterioare;"judetul Cluj,  Aleea Recoltei nr 20";"LOCUINTA UNIFAMILIALA IN REGIM CUPLAT P+E+M, IMPREJMUIRE TEREN SI AMENAJARI EXTERIOARE"
2017;544;11-05-2017;11-05-2017;137360;20-03-2017;P+M;extindere,continuare lucrari;locuinte unifamiliale-izolate;"judetul Cluj, Ion neculce, nr. 23";"CONTINUARE LUCRARI FARA MODIFICARE SOLUTIE CONSTRUCTIVA LA AC 132/17.02.2011, AC 283/21.03.2014-EXTINDERE LOCUINTA  CU UN CORP P+M Continuare lucrari:finisaje interioare, finisaje exterioare, instalatii"
2017;545;11-05-2017;11-05-2017;140829;21-03-2017;;construire;;"judetul Cluj, Strada Vlaicu Aurel, nr. 182";"INLOCUIRE MIJLOACE PUBLICITARE"
2017;546;11-05-2017;29-03-2017;190890;20-04-2017;P+E;construire,amenajare;locuinte unifamiliale-cuplate,imprejmuire,amenajari exterioare;"judetul Cluj, Recoltei, nr. 28";"CASĂ UNIFAMILIALĂ P+E IN SISTEM CUPLAT, ÎMPREJMUIRE, AMENAJARI EXTERIOARE. In urmatoarele conditii:  Se interzice modificarea parcelarului pana la receptionarea lucrarilor si eliberarea certificatului de atestare a edificarii constructiei; pana la finalizarea lucrarilor drumul de acces se va realiza la strat de uzura."
2017;547;12-05-2017;04-05-2017;201312;27-04-2017;;reparatie;;"judetul Cluj, Campului tronson Str. Izlazului – str. Mehedinti";"REPARATII SI INTRETINERE STR. CAMPULUI TRONSON STR. IZLAZULUI – STR. MEHEDINTI."
2017;548;12-05-2017;12-05-2017;122739;10-03-2017;S+P+E;construire,amenajare;locuinte unifamiliale-izolate,amenajari exterioare;"judetul Cluj, Edgar Quinet, nr. 17";"LOCUINTA FAMILIALA S+P+E CU 2 UNITATI LOCATIVE, AMENAJARI EXTERIOARE CU ZID DE SPRIJIN."
2017;549;12-05-2017;12-05-2017;175901;10-04-2017;S+P+E;construire,amenajare;locuinte unifamiliale-izolate,imprejmuire,amenajari exterioare;"judetul Cluj, Vasile Stoica, nr. 18";"CASĂ UNIFAMILIALĂ S+P+E, ÎMPREJMUIRE, AMENAJARI EXTERIOARE."
2017;550;12-05-2017;12-05-2017;176458;10-04-2017;;amenajare,amplasare;marcare;"judetul Cluj, Strada Buna Ziua, nr. 39, bl. E7D, et. P";"AMENAJARE CABINET STOMATOLOGIC SI AMPLASARE FIRMA LUMINOASA"
2017;551;12-05-2017;12-05-2017;152813;28-03-2017;;modificare solutie;;"judetul Cluj, Strada Sitarilor, nr. 21";"INTRARE IN LEGALITATE conform  PV. CSC. NR. 70948/28.09.2016 si modificare solutie constructiva autorizata cu AD nr.75 din 11.09.2015 pentru desfiintare totala imobil"
2017;552;12-05-2017;12-05-2017;189939;20-04-2017;;construire;locuinte unifamiliale-izolate;"judetul Cluj, Bulevard 1 Decembrie 1918, nr. 13";"DESFIINTARE CASA EXISTENTA"
2017;553;12-05-2017;12-05-2017;202693;27-04-2017;;amenajare;terasa sezoniera;"judetul Cluj, Strada Maniu Iuliu, nr. 1";"AMENAJARE TERASA SEZONIERA IN SISTEM PROVIZORIu SI DEMONTABIL DURATA DE EXISTENTA: PANA LA 31.10.2017 INVESTITOR: SC US Food Network SRL"
2017;554;12-05-2017;24-04-2017;185072;14-04-2017;;bransare;;"judetul Cluj, Răchitei nr.2";"BRANSAMENT DE GAZE NATURALE DE PRESIUNE REDUSA ( in montaj subteran) ,  P.R."
2017;555;15-05-2017;15-05-2017;189081;19-04-2017;;extindere,modificari interioare,amplasare;balcon;"judetul Cluj, municipiul Cluj-Napoca, Observatorului, Strada, nr. 11, ap. 11";"REALIZARE ACCES DIN EXTERIOR, BALCON ÎNCHIS, MODIFICĂRI INTERIOARE  AMPLASARE FIRMĂ PE FAȚADĂ– în sistem provizoriu și demontabil"
2017;556;15-05-2017;15-05-2017;179119;11-04-2017;PARTER;extindere;balcon;"judetul Cluj, Strada Vlahuta Alexandru, nr. 37, ap. 37";"BALCON LA PARTER"
2017;557;15-05-2017;15-05-2017;157391;30-03-2017;;amenajare,amplasare;comert,marcare;"judetul Cluj, municipiul Cluj-Napoca, Bucuresti, Strada, nr. 79, ap. 33/2";"REAMENAJARE SPAȚIU COMERCIAL EXISTENT ȘI AMPLASARE FIRMĂ LUMINOASĂ- în sistem provizoriu și demontabil"
2017;558;16-05-2017;16-05-2017;202972;27-04-2017;P+E;construire,amenajare;locuinte unifamiliale-izolate,imprejmuire,amenajari exterioare;"judetul Cluj, Beclean, nr. 6";"LOCUINTA SEMICOLECTIVA CU DOUA UNITATI LOCATIVE P+E, IMPREJMUIRE, AMENAJARI EXTERIOARE"
2017;559;16-05-2017;28-04-2017;190928;20-04-2017;;construire;;"judetul Cluj, tr. Al. Vaida Voevod, Unirii, Aleea I.T. Stan";"SENS GIRATORIU LA INTERSECTIA DINTRE STRADA ALEXANDRU VAIDA VOEVOD – STRADA UNIRII – ALEEA PROFESOR I.T. STAN"
2017;560;16-05-2017;16-05-2017;160036;31-03-2017;S+P+E;construire,amenajare;locuinte unifamiliale-izolate,imprejmuire,amenajari exterioare;"judetul Cluj, Ioan Iacob, nr. 20";"LOCUINTA SEMICOLECTIVA CU DOUA UNITATI LOCATIVE S+P+E, IMPREJMUIRE, AMENAJARI EXTERIOARE"
2017;561;17-05-2017;17-05-2017;215414;08-05-2017;;reparatie;;"judetul Cluj, tronson I de la Aleea Clabucet pana la str. Valea Garbaului.";"LUCRARI DE INTRETINERE SI REPARATII DRUMUL SFANTUL IOAN – TRONSON I – DE LA ALEEA CLABUCET PANA LA STRADA VALEA GARBAULUI."
2017;562;17-05-2017;17-05-2017;188848;19-04-2017;;construire;;"judetul Cluj, Piata Unirii, nr. 29";"REABILITARE SOCLU IMOBIL EXISTENT."
2017;563;17-05-2017;17-05-2017;163508;03-04-2017;;extindere,etajare,amenajare;;"judetul Cluj, Strada Republicii, nr. 8";"REABILITARE, MANSARDARE, EXTINDERE IMOBIL EXIST. SI TRANSF. IN IMOBIL MIXT (UNITATE DE SANATATE CU CARACTER AMBULATORIU, PARCAJ SUBTERAN), AMENAJARI EXT.  IMPREJM. ,"
2017;564;18-05-2017;18-05-2017;173807;07-04-2017;P+E;construire,modificari interioare,amenajare;locuinte unifamiliale-izolate,imprejmuire,acoperis,amenajari exterioare;"judetul Cluj, Sovata, nr. 3";"MODIFICARI PE PARCURSUL EXECUTIEI LA LUCRARI DE CONSTRUIRE CASĂ FAMILIALĂ P+E CU 2 UNITATI LOCATIVE, ÎMPREJMUIRE, AMENAJARI EXTERIOARE, AUTORIZATE CU A.C. nr.1132/19.07.2016. Modificarile propuse: modificare dimensiuni si forma in plan, modificari interioare, acoperis si fatade se incadreaza in limitele avizelor si acordurilor obtinute."
2017;565;18-05-2017;18-05-2017;158822;30-03-2017;D+P+R;construire;locuinte unifamiliale-izolate;"judetul Cluj, Alexandre DUMAS, nr. 12";"LOCUINTA FAMILIALA CU DOUA UNITATI LOCATIVE D+P+R"
2017;566;18-05-2017;08-05-2017;194486;24-04-2017;;bransare;;"judetul Cluj, ZAICU IOAN  NR. 6 APT.1";"BRANȘAMENT APĂ ȘI RACORD CANAL MENAJER ."
2017;567;18-05-2017;08-05-2017;194491;24-04-2017;;bransare;;"judetul Cluj, ZAICU IOAN  NR. 4 APT.1";"BRANȘAMENT APĂ ȘI RACORD CANAL MENAJER ."
2017;568;18-05-2017;05-05-2017;195740;24-04-2017;;bransare;;"judetul Cluj, SABIN DRĂGOI nr. 13-15";"BRANȘAMENT APĂ ."
2017;569;18-05-2017;09-05-2017;199919;26-04-2017;;bransare;;"judetul Cluj, OLEANDRULUI  NR. 26";"BRANȘAMENT DE GAZE NATURALE DE PRESIUNE REDUSA ( in montaj subteran) ,  P.R."
2017;570;18-05-2017;09-05-2017;199927;26-04-2017;;bransare;;"judetul Cluj, Oleandrului   nr.28";"BRANȘAMENT DE GAZE NATURALE DE PRESIUNE REDUSA ( in montaj subteran) ,  P.R."
2017;571;18-05-2017;18-05-2017;207138;02-05-2017;P+M;construire,modificari interioare,modificare solutie,amenajare;locuinte unifamiliale-izolate,imprejmuire,amenajari exterioare;"judetul Cluj, Strada Fagetului, nr. 16B";"MODIFICAREA SOLUTIEI CONSTRUCTIVE PE PARCURSUL EXECUTARII LUCRARILOR AUTORIZATE INITIAL  CU  AC 1582 DIN 16.11.2009, AC 1541 DIN 12.12.2012 si AC 562 DIN 29.05.2014, PENTRU „CONSTRUIRE LOCUINTA UNIFAMILIALA P+M, IMPREJMUIRE SI AMENAJARI EXTERIOARE”  MODIFICARI PROPUSE: RENUNTARE SEMINEU SI COS DE FUM, MODIFICARI INTERIOARE, MODIFICARE POZITIE SI DIMENSIUNI GOLURI, MODIFICARI FATADE SI AMENAJARI EXTERIOARE,  CU INCADRAREA IN LIMITELE AVIZELOR si ACORDURILOR OBTINUTE."
2017;572;19-05-2017;19-05-2017;192672;21-04-2017;;bransare;;"judetul Cluj, Strada Cantonului, nr. 18";"BRANSAMENT GAZE NATURALE PRESIUNE REDUSA."
2017;573;19-05-2017;19-05-2017;192638;21-04-2017;;bransare;;"judetul Cluj, Mircea Zaciu, nr. 1-3";"BRANSAMENT GAZE NATURALE PRESIUNE REDUSA."
2017;574;19-05-2017;19-05-2017;206364;02-05-2017;S+P+E;extindere,etajare,amenajare;locuinte unifamiliale-izolate,amenajari exterioare;"judetul Cluj, Strada Alverna, nr. 11";"EXTINDERE SI ETAJARE CASĂ UNIFAMILIALĂ CU REGIM FINAL DE ÎNĂLŢIME S+P+E, AMENAJARI EXTERIOARE."
2017;575;19-05-2017;12-05-2017;204889;28-04-2017;;extindere,bransare;;"judetul Cluj, SOBARILOR NR. 38 IMOBIL 7 SC. A,B,C";"EXTINDERE  CONDUCTĂ  GAZ DE PRESIUNE REDUSĂ ŞI  TREI  BRANSAMENTE DE GAZE NATURALE DE PRESIUNE REDUSA ( in montaj subteran) ,     3 P.R."
2017;576;19-05-2017;15-05-2017;222816;10-05-2017;;bransare;;"judetul Cluj,  FLORILOR NR.15  provizoriu";"BRANSAMENT DE GAZE NATURALE DE PRESIUNE REDUSA ( in montaj subteran   ) ,  P.R."
2017;577;19-05-2017;19-05-2017;192439;21-04-2017;PARTER,PARTER;construire,modernizare,amenajare;birouri;"judetul Cluj, Clinicilor nr 3-5";"MODERNIZARE BUCATARIE, CONSTRUIRE SUPANTA LA PARTER SI AMENAJARE SPATII PENTRU BIROURI, MODERNIZARE FINISAJE INTERIOARE, INLOCUIRE TAMPLARIE FERESTRE LA PARTER"
2017;578;22-05-2017;12-05-2017;204882;28-04-2017;;extindere,bransare;;"judetul Cluj, SOPORULUI NR.1 ( actual nr.8 ) BL. A1 SC. 1,2,3, BL. A2 SC. 1,2,3, BL. B1 SC. 1,2,3,  BL. B2 SC. 1,2,3, BL.C SC. 1,2,3";"EXTINDERE  CONDUCTĂ  GAZ DE PRESIUNE REDUSĂ ŞI  15  BRANSAMENTE DE GAZE NATURALE DE PRESIUNE REDUSA ( in montaj subteran) ,    15 P.R."
2017;579;22-05-2017;11-05-2017;202864;27-04-2017;;bransare;;"judetul Cluj,  MĂCEȘULUI   NR. 58B";"BRANSAMENT DE GAZE NATURALE DE PRESIUNE REDUSA ( in montaj subteran) ,  P.R."
2017;580;22-05-2017;11-05-2017;202877;27-04-2017;;bransare;;"judetul Cluj, Colonie Faget, nr. 10G";"BRANSAMENT DE GAZE NATURALE DE PRESIUNE REDUSA ( in montaj subteran) ,  P.R."
2017;581;22-05-2017;15-05-2017;209980;03-05-2017;;bransare;;"judetul Cluj,  CĂTINEI NR.5B";"BRANSAMENT DE GAZE NATURALE DE PRESIUNE REDUSA ( in montaj subteran) ,  P.R."
