year;index;data-afisare;data-creare;data-cerere;nr.cerere;regim-h;actiune;tip-lucrari;adresa;titlu
2017;970;26-07-2017;26-07-2017;301356;27-06-2017;;construire;locuinte colective;"judetul Cluj, c-tin NOICA, nr. 4";"RELOCARE PTAB DACADA SI DEVIERE LES 0.4KV PENTRU ANSAMBLUL REZIDENTIAL DE LOCUINTE COLECTIVE PE STR. CONSTANTIN NOICA, NR.2-4"
2017;971;26-07-2017;26-07-2017;279015;14-06-2017;;construire,amenajare;locuinte unifamiliale-izolate,imprejmuire,amenajari exterioare;"judetul Cluj, Strada Mikszath Kalman, nr. 52A";"LOCUINTA SEMICOLECTIVA CU 2 UNITATI LOCATIVE S+P+E+Er, IMPREJMUIRE, AMENAJARI EXTERIOARE"
2017;972;26-07-2017;26-07-2017;293431;22-06-2017;P+E;construire,amenajare;locuinte unifamiliale-izolate,imprejmuire,amenajari exterioare;"judetul Cluj, Strada Sebastian Mihail, nr. 8";"CONSTRUIRE LOCUINTA FAMILIALA P+E CU DOUA UNITATI LOCATIVE,  IMPREJMUIRE SI AMENAJARI EXTERIOARE  In urmatoarele conditii:  Se interzice modificarea parcelarului pana la receptionarea lucrarilor si eliberarea certificatului de atestare a edificarii constructiei."
2017;973;26-07-2017;26-07-2017;309703;03-07-2017;;renovare;locuinte unifamiliale-izolate,comert;"judetul Cluj, PiatA MIHAI VITEAZU , nr. 22-23, ap. 6";"SCHIMBARE PARTIALA DE DESTINATIE DIN LOCUINTA IN SPATIU PENTRU ACTIVITATI COMERCIALE, REALIZARE ACCES SPRE SPATIU PUBLIC, REFATADIZARE IMOBIL"
2017;974;26-07-2017;26-07-2017;304609;29-06-2017;S+P;etajare,consolidare,amenajare;amenajari exterioare;"judetul Cluj, Oasului, Strada, nr. 36";"MANSARDARE SI CONSOLIDARE IMOBIL S+P SI AMENAJARI EXTERIOARE  In urmatoarele conditii:  Se interzice modificarea parcelarului pana la receptionarea lucrarilor si eliberarea certificatului de atestare a edificarii constructiei."
2017;975;26-07-2017;10-07-2017;312185;04-07-2017;;bransare;;"judetul Cluj, Cetinei , nr. 9";"BRANSAMENT DE GAZE NATURALE DE PRESIUNE REDUSA ( in montaj subteran) ,  P.R."
2017;976;26-07-2017;13-07-2017;306308;30-06-2017;;bransare;;"judetul Cluj, CALEA TURZII NR.188 provizoriu";"ALIMENTARE CU ENERGIE ELECTRICĂ IMOBIL EXISTENT ."
2017;977;26-07-2017;05-07-2017;302810;28-06-2017;;extindere,bransare;;"judetul Cluj, CÂMPULUI NR. 253 provizoriu";"EXTINDERE  CONDUCTĂ APĂ ȘI CANALIZARE MENAJERĂ ,  5 BRANȘAMENTE APĂ , 5 RACORDURI CANAL MENAJER."
2017;978;26-07-2017;10-07-2017;309301;03-07-2017;;bransare;;"judetul Cluj, HAMEIULUI  NR.9";"BRANSAMENT DE GAZE NATURALE DE PRESIUNE REDUSA ( in montaj subteran) ,  P.R."
2017;979;26-07-2017;10-07-2017;309304;03-07-2017;;bransare;;"judetul Cluj, Lucian Matiș nr.7 prov.";"BRANSAMENT DE GAZE NATURALE DE PRESIUNE REDUSA ( in montaj subteran) ,  P.R."
2017;980;26-07-2017;10-07-2017;308028;03-07-2017;;bransare;;"judetul Cluj,  ION NECULCE nr.8";"BRANSAMENT DE GAZE NATURALE DE PRESIUNE REDUSA ( in montaj subteran) ,  P.R."
2017;981;26-07-2017;26-07-2017;321329;11-07-2017;;modificari interioare;;"judetul Cluj, Strada Ghibu Onisifor, nr. 25";"MODIFICARI INTERIOARE LICEUL TEORETIC „AVRAM IANCU”"
2017;982;26-07-2017;14-07-2017;316069;06-07-2017;;schimbare destinatie;locuinte unifamiliale-izolate;"judetul Cluj, Cale Turzii, nr. 7, ap. 3";"SCHIMBARE DE DESTINATIE DIN LOCUINTA IN CABINET STOMATOLOGIC"
2017;983;26-07-2017;10-07-2017;293951;22-06-2017;Sp+P+E;construire,amenajare;locuinte unifamiliale-izolate,imprejmuire,amenajari exterioare;"judetul Cluj, Strada Stejarului, nr. 5";"CONSTRUIRE LOCUINTA FAMILIALA Sp+P+E, REFACERE IMPREJMUIRE, AMENAJARI EXTERIOARE"
2017;984;26-07-2017;26-07-2017;323999;12-07-2017;;construire;locuinte colective;"judetul Cluj, SALCâMULUI, STRADA, nr. 37, ap. 41";"REORGANIZARI INTERIOARE APARTAMENT NR. 41"
2017;985;27-07-2017;26-01-2017;292251;22-06-2017;;etajare;locuinte unifamiliale-izolate;"judetul Cluj, Strada Rodnei, nr. 6";"MANSARDARE CASA DE LOCUIT"
2017;986;27-07-2017;06-07-2017;272912;12-06-2017;;construire;garaj;"judetul Cluj, Strada Cantonului, nr. 24";"CONSTRUIRE GARAJ."
2017;987;27-07-2017;12-07-2017;281171;15-06-2017;;modificari interioare,amenajare;amenajari interioare;"judetul Cluj, Strada Bucegi, nr. 13-15, ap. 4B";"AMENAJARE SEDIU BANCA, RECOMPARTIMENTARE SI AMENAJARE INTERIOARA BCR CLUJ-NAPOCA -AGENTIA MANASTUR"
2017;988;27-07-2017;27-07-2017;323920;12-07-2017;;modificari interioare,amenajare;locuinte unifamiliale-izolate;"judetul Cluj";"REABILITARE CASA DE LOCUIT, AMENAJARE MANSARDA IN PODUL EXISTENT SI MODIFICARI INTERIOARE"
2017;989;28-07-2017;28-07-2017;281209;15-06-2017;;bransare;;"judetul Cluj, Stefan Ruha, nr. 28, 30";"2 BRANSAMENTE GAZE NATURALE DE PRESIUNE REDUSA"
2017;990;28-07-2017;28-07-2017;305262;29-06-2017;;extindere,etajare,modificari interioare;locuinte unifamiliale-izolate;"judetul Cluj, Strada Timisului, nr. 59";"EXTINDERE, MANSARDARE SI MODIFICARI INTERIOARE LA CASA UNIFAMILIALA"
2017;991;28-07-2017;19-07-2017;308033;03-07-2017;;bransare;;"judetul Cluj, Strada Macesului, nr. 36";"BRANSAMENT DE GAZE NATURALE DE PRESIUNE REDUSĂ ( in montaj subteran ) si P.R."
2017;992;28-07-2017;12-07-2017;281453;15-06-2017;;construire;amenajari interioare;"judetul Cluj, Strada Câmpului, nr. 227, ap. 7";"RECOMPARTIMENTARI INTERIOARE LA AP. 7."
2017;993;28-07-2017;28-07-2017;295265;23-06-2017;D+P+E;construire,modificare solutie,continuare lucrari,amenajare;locuinte unifamiliale-izolate,imprejmuire,amenajari exterioare;"judetul Cluj, FREZIEI, nr. 18";"INTRARE IN LEGALITATE CONFORM PROCESULUI VERBAL DE CONSTATARE SI SANCTIONARE A CONTRAVENTIILOR NR.79886 DIN 10.01.2017 – CONTINUARE LUCRARI CU MODIFICAREA SOLUTIEI CONSTRUCTIVE AUTORIZATA INITIAL CU AC 671 DIN 03.06.2013 PENTRU „CONSTRUIRE CASA UNIFAMILIALA D+P+E, IMPREJMUIRE SI AMENAJARI EXTERIOARE”"
2017;994;28-07-2017;27-07-2017;340890;24-07-2017;P;construire,urgenta,consolidare;;"judetul Cluj, Alexandru Vaida Voievod, nr. 53-55";"INTERVENTIE DE PRIMA NECESITATE – CONSOLIDARE TOTEM  In urmatoarele conditii: Conform Legii nr.50/1991, republicată, art.7, alin.(16), proiectul pentru autorizarea executarii lucrarilor de construire/desfiintare, proiectul tehnic P.T., detaliile de executie D.E.– vor fi elaborate si aprobate pe parcursul sau la incheierea executarii lucrarilor, cu respectarea avizelor si acordurilor, precum si, dupa caz, a actului administrativ al autoritatii competente pentru protectia mediului."
2017;995;28-07-2017;28-07-2017;322447;11-07-2017;D+P+M,D+P+M;modificari interioare,modificare solutie,continuare lucrari,amenajare;locuinte unifamiliale-izolate,imprejmuire,amenajari exterioare;"judetul Cluj, IoneL PERLEA, nr. 8";"Continuarea lucrarilor si modificarea solutiei constructive autorizate cu AC nr. 1531 din 6.09.2006 -Locuinta familiala cu regimul de inaltime D+P+M,IMPREJMUIREA TERENULUI SI MICROSTATIE DE EPURARE Modificarile ptropuse -modificare de goluri pe fatade,modificari interioare,finisaje,modificarea functiuni adapostului de protectie civila,amenajari exterioare cu incadrarea in limitele si avizele initiale Regimul de inaltime D+P+M"
2017;996;28-07-2017;28-07-2017;276249;13-06-2017;P+E;construire;locuinte unifamiliale-izolate;"judetul Cluj, RaOZMARINULUI, nr. 27";"Locuinta semicolectiva cu doua unitati locative cu regimul de inaltime P+E"
2017;997;28-07-2017;28-07-2017;276449;13-06-2017;P;construire;locuinte unifamiliale-izolate;"judetul Cluj, Strada Voievodul Gelu, nr. 44";"Locuinta unifamiliala cu regimul de inaltime P"
2017;998;31-07-2017;06-07-2017;299342;27-06-2017;S+P+E,parter;construire,modificari interioare,amenajare;locuinte unifamiliale-izolate,imprejmuire,acoperis,amenajari exterioare;"judetul Cluj, Murgu Eftimie, Strada, nr. 60 prov";"MODIFICARI PE PARCURSUL EXECUTIEI LA LUCRARI DE CONSTRUIRE CASĂ UNIFAMILIALĂ S+P+E, ÎMPREJMUIRE, AMENAJARI EXTERIOARE, AUTORIZATE CU A.C. Nr.2125/24.11.2016. Modificarile propuse: modificarea inaltimii libere la parter si etaj (fara modificarea inaltimii maxime a constructiei), modificare structura acoperis, modificari interioare si fatade, modificare materiale imprejmuire, se incadreaza in limitele avizelor si acordurilor obtinute. In urmatoarele conditii:  Se interzice modificarea parcelarului pana la receptionarea lucrarilor si eliberarea certificatului de atestare a edificarii constructiei."
2017;999;1-08-2017;15-07-2017;302078;28-06-2017;PARTER;construire;;"judetul Cluj, Alee Rasinari, nr. 2, 4, 45, 48";"CONSTRUIRE BALCOANE DESCHISE LA PARTER LA AP. 2, 4, 45, 48."
2017;1000;1-08-2017;11-07-2017;270835;09-06-2017;P+E;construire,amenajare;locuinte unifamiliale-izolate,amenajari exterioare;"judetul Cluj, Colonia Faget, nr. 31H";"LOCUINTA UNIFAMILIALA P+E SI AMENAJARI EXTERIOARE"
2017;1001;1-08-2017;06-07-2017;303081;28-06-2017;P+E+M;extindere,etajare,modificare solutie,amenajare;locuinte colective,imprejmuire,amenajari exterioare,amenajari interioare;"judetul Cluj, Iuliu Moldovan, nr. 1";"MODIFICARE DE SOLUTIE LA A.C. NR.1469 DIN 15.12.2015 ELIBERATA PENTRU  „EXTINDERE SI SUPRAETAJARE IMOBIL EXISTENT PENTRU REALIZARE IMOBIL            P+E+M CU 3 APARTAMENTE, IMPREJMUIRE SI AMENAJARI EXTERIOARE” Modificari propuse: recompartimentari interioare, modificari de fatade – cu incadrarea in limitele avizelor/acordurilor obtinute pentru autorizatia initiala."
2017;1002;1-08-2017;01-08-2017;274762;13-06-2017;;extindere,bransare;;"judetul Cluj, SOPORULUI NR. 13-15 prov. Scara I și II";"EXTINDERE CONDUCTĂ APĂ ȘI CANALIZARE MENAJERĂ ,2 BRANȘAMENTE APĂ ȘI  2 RACORDURI  CANAL MENAJER ."
2017;1003;1-08-2017;06-07-2017;274789;13-06-2017;;bransare;;"judetul Cluj, MELODIEI NR. 6  BL. D";"PRELUNGIRE CONDUCTA APA SI CANALIZARE SI2  BRANSAMENTE SPA SI 2 RACORDURI CANAL MENAJER"
2017;1004;1-08-2017;04-07-2017;290816;21-06-2017;;bransare;;"judetul Cluj, ZARANDULUI  NR. 15";"2 BRANSAMENTE DE APA SI 2 RACORDURI CANAL"
2017;1005;1-08-2017;01-08-2017;305115;29-06-2017;;bransare;;"judetul Cluj, STRADA  ALEXANDRU VAIDA VOIEVOD  NR. 16 provizoriu CORP 1B  , 14";"ALIMENTARE CU ENERGIE ELECTRICĂ IMOBIL EXISTENT -CORP 1B ."
2017;1006;1-08-2017;07-07-2017;309308;03-07-2017;;extindere,bransare;;"judetul Cluj, TRACTORIȘTILOR NR.17,19";"EXTINDERE  CONDUCTA  GAZ DE PRESIUNE REDUSA  ȘI 2 BRANSAMENTE   DE GAZE NATURALE DE PRESIUNE REDUSA ( in montaj subteran) ,   2   P.R."
2017;1007;1-08-2017;12-07-2017;276371;13-06-2017;;construire;locuinte colective;"judetul Cluj, Strada Uzinei Electrice, nr. 19, et. 3, ap. 21";"MODIFICARE COMPARTIMENTARE APARTAMENT NR 21"
2017;1008;1-08-2017;06-07-2017;301018;27-06-2017;;construire,amenajare;locuinte unifamiliale-izolate,imprejmuire,amenajari exterioare;"judetul Cluj, Strada Macinului, nr. 17";"LOCUINTA SEMICOLECTIVA S+P+E+Er CU 2 UNITATI LOCATIVE, ÎMPREJMUIRE, AMENAJARI EXTERIOARE. In urmatoarele conditii:  Se interzice modificarea parcelarului pana la receptionarea lucrarilor si eliberarea certificatului de atestare a edificarii constructiei."
2017;1009;1-08-2017;01-08-2017;316234;06-07-2017;;construire,amenajare;birouri,amenajari exterioare;"judetul Cluj, Strada Salajului, nr. 1-3";"CONSTRUIRE IMOBIL CU FUNCTIUNI MIXTE (LOCUINTE SI BIROURI) SI AMENAJARI EXTERIOARE REGIM DE INALTIME S+P+2E+Er"
2017;1010;1-08-2017;03-07-2017;280551;15-06-2017;;schimbare destinatie;servicii,garaj;"judetul Cluj, Strada Baba Novac, nr. 15";"SCHIMBARE DESTINATIE DIN SPATIU ATELIER SI GARAJ IN SPATII PENTRU SERVICII PROFESIONALE"
2017;1011;1-08-2017;20-07-2017;303466;28-06-2017;D+P+E;modificare solutie,amenajare;locuinte unifamiliale-izolate,imprejmuire,acoperis,amenajari exterioare;"judetul Cluj, Strada Moricz Zsigmond, nr. 32";"MODIFICARE DE SOLUTIE LA LOCUINTA COLECTIVA MICA CU 4 UNITATI LOCATIVE D+P+E, IMPREJMUIRE SI AMENAJARI EXTERIOARE AUTORIZATE CU A.C. NR.759/15.06.2016 Modificari propuse: modificare parapeti balcoane, forma sarpanta si finisaje exterioare, modificare amenajari exterioare - cu incadrarea in limitele avizelor/acordurilor obtinute pentru autorizatia initiala. In urmatoarele conditii:  Se interzice modificarea parcelarului pana la receptionarea lucrarilor si eliberarea certificatului de atestare a edificarii constructiei."
2017;1012;1-08-2017;20-07-2017;322765;11-07-2017;Dp+P+E;modificari interioare,modificare solutie,amenajare;locuinte unifamiliale-izolate,amenajari exterioare;"judetul Cluj, Victor Papilian, nr. 32";"MODIFICARE DE SOLUTIE LA CASA UNIFAMILIALA CU REGIM DE INALTIME Dp+P+E SI AMENAJARI EXTERIOARE AUTORIZATE CU A.C. NR.1213/02.10.2015 SI NR.761/05.07.2011  Modificari propuse: modificari interioare si inchiderea terasei de la etaj – cu incadrarea in limitele avizelor/acordurilor obtinute pentru autorizatia initiala. In urmatoarele conditii:  Se interzice modificarea parcelarului pana la receptionarea lucrarilor si eliberarea certificatului de atestare a edificarii constructiei."
2017;1013;1-08-2017;01-08-2017;323017;11-07-2017;;amenajare;terasa sezoniera;"judetul Cluj, Piata Unirii, nr. 3";"AMENAJARE TERASA SEZONIERA IN SISTEM PROVIZORIU SI DEMONTABIL DURATA DE EXISTENTA: PANA LA 31.10.2017 INVESTITOR: SC ART OF CAKES SRL"
2017;1014;2-08-2017;02-08-2017;327964;14-07-2017;;reabilitare termica;;"judetul Cluj, str. Hateg , nr. 4, bl. lama G";"CRESTEREA EFICIENTEI ENERGETICE A BLOCURILOR DE LOCUIT, STR. HATEG NR.4, LAMA G, LOCALITATEA CLUJ-NAPOCA, JUDETUL CLUJ, IN SCOPUL:REABILITARE TERMICA BLOC DE LOCUIT PRIN POR 2014-2020. AXA PRIORITARA 3, PRIORITATE DE INVESTITII 3.1, OPERATIUNEA A-CLADIRI REZIDENTIALE"
2017;1015;2-08-2017;20-07-2017;316424;06-07-2017;;construire;;"judetul Cluj, Erich Bergel, nr. 28";"BRANSAMENT ELECTRIC TRIFAZAT ( in montaj subteran )."
2017;1016;2-08-2017;02-08-2017;296115;23-06-2017;;construire;;"judetul Cluj, Cale Dorobantilor, nr. 9-11, ap. 6,10,14";"Construire balcoane la ap.6,10,14"
2017;1017;2-08-2017;02-08-2017;336280;20-07-2017;;construire;;"judetul Cluj, Fabricii,Strada Piata Marasti.";"REALIZARE BRETELE SENS GIRATORIU MARASTI SPRE SI DINSPRE STR. FABRICII"
2017;1018;2-08-2017;02-08-2017;336288;20-07-2017;;amenajare;;"judetul Cluj, Calea Turzii si Piata Cipariu";"REAMENAJARE ZONA CALEA TURZII CU PIATA CIPARIU"
2017;1019;2-08-2017;28-07-2017;237926;18-05-2017;;construire;;"judetul Cluj, Cal. Manastur, str. Campului";"REALIZARE SENS GIRATORIU LA INTERSECTIA DINTRE STRADA CALEA MANASTUR – STRADA CAMPULUI."
2017;1020;3-08-2017;03-08-2017;291259;21-06-2017;;amenajare;imprejmuire,amenajari exterioare;"judetul Cluj, Colonia Faget, nr. 33A pr";"FILIGORIE IN REGIM PROVIZORIU, ÎMPREJMUIRE, AMENAJARI EXTERIOARE. Durata de existenta filigorie: 10 ani (conform declaratie notariala din 07.07.2017)."
2017;1021;3-08-2017;15-07-2017;285463;19-06-2017;;modificari interioare,schimbare destinatie;locuinte unifamiliale-izolate,locuinte colective,servicii,amenajari interioare;"judetul Cluj, Strada Paris, nr. 15, ap. 2";"RECOMPARTIMENTARE APARTAMENT SI SCHIMBARE DE DESTINATIE DIN LOCUINTA IN SPATIU DE SERVICII CU ACCES PUBLIC"
2017;1022;3-08-2017;03-08-2017;266094;07-06-2017;P+E;construire;locuinte unifamiliale-izolate,imprejmuire;"judetul Cluj, Strada Voievodul Gelu, nr. 1B";"Casa unifamiliala,imprejmuirea terenului cu regimul P+E"
2017;1023;3-08-2017;03-08-2017;298215;26-06-2017;S+P+E;renovare;locuinte unifamiliale-izolate;"judetul Cluj, Strada Hossu Iuliu, cardinal, nr. 37";"REFATADIZARE IMOBIL- CASA S+P+E"
2017;1024;3-08-2017;03-08-2017;325670;13-07-2017;;amplasare;locuinte unifamiliale-izolate;"judetul Cluj, P-taUnirii ,str.Reg. Ferdinand,P-ta Muzeului,Motilor";"AMPLASARE INDICATOARE TURISTICE PIETONALE PE DOMENIUL PUBLIC -in urmatoarele locatii: Piata Unirii Sud-Vest, Piata Unirii Nord-Vest, Piata Unirii Sud-Est, Zona Baritiu-Pod Horea, Piata Muzeului, Casa Matia Corvin, Intersectia str. Emil Isac si Memorandumului;"
2017;1025;4-08-2017;10-07-2017;301246;27-06-2017;;extindere,bransare;;"judetul Cluj, BORHANCIULUI NR.56-58";"EXTINDERE  CONDUCTĂ APĂ ,CANALIZARE MENAJERĂ , CONDUCTĂ DE GAZE NATURALE DE PRESIUNE REDUSĂ ȘI REȚEA ELECTRICĂ  ( toate  în montaj subteran ) ."
2017;1026;4-08-2017;15-07-2017;288956;20-06-2017;S+P+5E+R;construire,amenajare;garaj,imprejmuire,amenajari exterioare;"judetul Cluj, Strada Caii Ferate, nr. 11";"CONSTRUIRE IMOBIL CU FUNCTIUNI MIXTE (GARAJ SUBTERAN, DOTARI SI LOCUINTE) CU REGIM DE INALTIME S+P+5E+R, REFACERE IMPREJMUIRE SI AMENAJARI EXTERIOARE   In urmatoarele conditii:  Se interzice modificarea parcelarului pana la receptionarea lucrarilor si eliberarea certificatului de atestare a edificarii constructiei."
2017;1027;7-08-2017;07-08-2017;320065;10-07-2017;;bransare;;"judetul Cluj, Strada Smârdan, nr. 10-12";"BRANSAMENT DE GAZE NATURALE DE PRESIUNE REDUSĂ (in montaj subteran) si P.R."
2017;1028;7-08-2017;21-07-2017;326018;13-07-2017;D+P+2E;modificare solutie,amenajare;birouri,amenajari exterioare;"judetul Cluj, Strada Taietura Turcului, nr. 47";"MODIFICARE DE SOLUTIE LA CLADIRE DE BIROURI CU REGIM DE INALTIME D+P+2E SI AMENAJARI EXTERIOARE AUTORIZATE CU A.C. NR.359/30.03.2015 Modificari propuse la: compartimentari interioare, finisaje interioare si exterioare, goluri din fatada, structura, instalatii – cu incadrarea in limtele avizelor/acordurilor obtinute pentru autorizatia initiala"
2017;1029;7-08-2017;18-07-2017;321520;11-07-2017;S+P+E;continuare lucrari,amenajare;locuinte unifamiliale-izolate,amenajari exterioare;"judetul Cluj, Medias, nr. 2";"CONTINUARE DE LUCRARI FARA MODIFICARE DE SOLUTIE LA CASA UNIFAMILIALA CU REGIM DE INALTIME S+P+E SI AMENAJARI EXTERIOARE AUTORIZATE CU A.C. NR.952 DIN 30.07.2012   In urmatoarele conditii:  Se interzice modificarea parcelarului pana la receptionarea lucrarilor si eliberarea certificatului de atestare a edificarii constructiei."
2017;1030;7-08-2017;25-07-2017;331141;17-07-2017;;bransare;;"judetul Cluj, Strada Bibescu George Valentin, nr. 48";"2 BRANSAMENTE GAZE NATURALE"
2017;1031;7-08-2017;27-07-2017;333671;18-07-2017;P+E;construire,amenajare;locuinte unifamiliale-izolate,amenajari exterioare;"judetul Cluj, Colonia Borhanci, nr. 3f";"CASA UNIFAMILIALA P+E SI AMENAJARI EXTERIOARE   In urmatoarele conditii:  Se interzice modificarea parcelarului pana la receptionarea lucrarilor si eliberarea certificatului de atestare a edificarii constructiei."
2017;1032;7-08-2017;07-08-2017;332003;18-07-2017;;bransare;;"judetul Cluj, Poienitei, nr. 10";"BRANSAMENT SI POST REGLARE-MASURARE GAZE NATURALE DE PRESIUNE REDUSA"
2017;1033;7-08-2017;07-08-2017;326977;13-07-2017;;amplasare;marcare;"judetul Cluj, Strada Regele Ferdinand, nr. 22-26";"AMPLASARE FIRMA LUMINOASA PE FATADA IMOBILULUI"
2017;1034;7-08-2017;19-07-2017;327136;13-07-2017;P+E;modificare solutie,amenajare;imprejmuire,amenajari exterioare;"judetul Cluj, Strada Borhanciului, nr. 45B";"MODIFICARE DE SOLUTIE CONSTRUCTIVA LA IMOBIL MIXT P+E, IMPREJMUIRE SI AMENAJARI EXTERIOARE AUTORIZATE CU A.C. NR.1150/19.07.2016  Modificari propuse: reducerea suprafetelor imobilului – cu incadrarea in limitele avizelor si acordurilor obtinute pentru autorizatia initiala. In urmatoarele conditii:  Se interzice modificarea parcelarului pana la receptionarea lucrarilor si eliberarea certificatului de atestare a edificarii constructiei."
2017;1035;7-08-2017;28-07-2017;337934;20-07-2017;S+P+M;construire,amenajare;locuinte unifamiliale-izolate,amenajari exterioare;"judetul Cluj, BALTAG CEZAR, STRADA, nr. 18A";"CASA UNIFAMILIALA S+P+M SI AMENAJARI EXTERIOARE   In urmatoarele conditii:  Se interzice modificarea parcelarului pana la receptionarea lucrarilor si eliberarea certificatului de atestare a edificarii constructiei."
2017;1036;7-08-2017;07-08-2017;332953;18-07-2017;d+p+e+m;construire,continuare lucrari,amenajare;locuinte colective,servicii,imprejmuire,amenajari exterioare;"judetul Cluj, Strada Vântului, nr. 72";"CONTINUARE DE LUCRARI FARA MODIFICARI LA IMOBIL AUT. CU AC. NR. 905/23.07.2013 PENTRU CONSTRUIRE IMOBIL DE LOCUINTE COLECTIVE, SERVICII PROFESIONALE CU MAXIM 200mpadc, regim de inaltime d+p+e+m, imprejmuire si amenajari exterioare""
2017;1037;7-08-2017;21-06-2017;280091;15-06-2017;;extindere,etajare,modificari interioare,amenajare;locuinte unifamiliale-izolate,amenajari exterioare;"judetul Cluj, Strada Cucului, nr. 3";"MODIFICARI INTERIOARE, EXTINDERE SI MANSARDARE CASA EXISTENTA IN VEDEREA REALIZARII UNEI LOCUINTE SEMICOLECTIVE CU 2 UNITATI LOCATIVE, AMENAJARI EXTERIOARE. In urmatoarele conditii:  Se interzice modificarea parcelarului pana la receptionarea lucrarilor si eliberarea certificatului de atestare a edificarii constructiei."
2017;1038;7-08-2017;07-08-2017;303115;28-06-2017;;amenajare;;"judetul Cluj, Strada Memorandumului, nr. 4";"AMENAJARE ACCES INCINTA SI CURTE INTERIOARA IMOBIL."
2017;1039;8-08-2017;08-08-2017;288597;20-06-2017;;construire;imprejmuire;"judetul Cluj, Strada Dunarii, nr. 16";"ÎMPREJMUIRE."
2017;1040;8-08-2017;31-07-2017;343389;25-07-2017;;bransare;;"judetul Cluj, Lucian Matis, nr. 9";"BRANSAMENT GAZE NATURALE"
2017;1041;8-08-2017;31-07-2017;343905;25-07-2017;;bransare;;"judetul Cluj, UlMULUI, nr. 12";"BRANSAMENT APA SI RACORD CANAL  In urmatoarele conditii:  Lucrarile se vor executa in baza autorizatiei de spargere, cu respectarea conditiilor din avizele si studiile obtinute. La finalizarea lucrarii terenul se va readuce in starea initiala.  Executantul va obtine acordul Politiei Rutiere Cluj inainte de inceperea lucrarilor, pentru semnalizarea corespunzatoare a acestora si impunerea restrictiilor pe drum."
2017;1042;8-08-2017;08-08-2017;330736;17-07-2017;;bransare;;"judetul Cluj, Strada Artarului, nr. 6A";"Alimentare cu energie electrica"
2017;1043;9-08-2017;22-07-2017;283858;19-06-2017;;amplasare;;"judetul Cluj, Bulevard 21 Decembrie 1989, nr. 129";"AMPLASARE FIRMA PE FATADA IMOBIL CU CARACTER PROVIZORIU SI DEMONTABIL."
2017;1044;9-08-2017;01-08-2017;342342;25-07-2017;;extindere,bransare;;"judetul Cluj, VÂNĂTORULUI NR. 67 provizoriu CORP 1,2,3";"EXTINDERE  CONDUCTĂ  GAZ DE PRESIUNE REDUSĂ ŞI  3 BRANSAMENTE DE GAZE NATURALE DE PRESIUNE REDUSA ( in montaj subteran) ,  3 P.R."
2017;1045;9-08-2017;09-08-2017;334100;19-07-2017;;renovare;birouri,hala;"judetul Cluj, Piata 1 Mai, nr. 4-5";"REFATADIZARE IMOBIL-HALA BIROURI"
2017;1046;9-08-2017;02-08-2017;347076;27-07-2017;;bransare;;"judetul Cluj, Borhanciului    nr. 76F";"BRANSAMENT DE GAZE NATURALE DE PRESIUNE REDUSA ( in montaj subteran) ,  P.R."
2017;1047;10-08-2017;01-08-2017;345412;26-07-2017;;bransare;;"judetul Cluj, Gheorghe Sion, nr. 42";"BRANSAMENT APA SI RACORD CANAL  In urmatoarele conditii:  Lucrarile se vor executa in baza autorizatiei de spargere, cu respectarea conditiilor din avizele si studiile obtinute. La finalizarea lucrarii terenul se va readuce in starea initiala.  Executantul va obtine acordul Politiei Rutiere Cluj inainte de inceperea lucrarilor, pentru semnalizarea corespunzatoare a acestora si impunerea restrictiilor pe drum."
2017;1048;10-08-2017;24-06-2017;265825;07-06-2017;;etajare,modificari interioare;locuinte unifamiliale-izolate;"judetul Cluj, Nadasel, Strada, nr. 10";"MODIFICARI INTERIOARE SI MANSARDARE LOCUINTA UNIFAMILIALA CORP - C1"
2017;1049;10-08-2017;10-08-2017;322688;11-07-2017;;bransare;;"judetul Cluj, PINTEA VITEAZU, nr. 3A PROVIZORIU";"BRANSAMENT DE GAZE NATURALE DE PRESIUNE REDUSĂ (in montaj subteran) si P.R."
2017;1050;10-08-2017;10-08-2017;353204;01-08-2017;;amplasare;;"judetul Cluj, SOPORULUI";"LUCRARI DE MONTARE STATIE DE INCARCARE AUTOBUZE ELECTRICE"
2017;1051;10-08-2017;10-08-2017;353209;01-08-2017;;amplasare;;"judetul Cluj, AUREL VLAICU";"LUCRARI DE MONTARE STATIE DE INCARCARE AUTOBUZE ELECTRICE"
2017;1052;10-08-2017;31-07-2017;317023;07-07-2017;;construire;;"judetul Cluj, Strada Harghita, nr. 36";"BRANSAMENT ELECTRIC TRIFAZAT – in montaj subteran."
2017;1053;10-08-2017;29-07-2017;316006;06-07-2017;;bransare;;"judetul Cluj, Alexandre Dumas, nr. 26";"BRANSAMENT DE APĂ SI DOUA RACODURI CANAL."
2017;1054;10-08-2017;10-08-2017;302899;28-06-2017;P;reparatie,consolidare;locuinte unifamiliale-izolate;"judetul Cluj, Strada Odobesti, nr. 25";"Reparatii si consolidare casa unifamiliala cu regimul de inaltime P"
2017;1055;10-08-2017;10-08-2017;318143;07-07-2017;;bransare;;"judetul Cluj, Strada Nucului, nr. 4";"Bransament apa si racord canal,bransament electric trifazat"
2017;1056;10-08-2017;10-08-2017;295403;23-06-2017;;bransare;;"judetul Cluj, Vanatorului, nr. 40";"Bransament de gaze"
2017;1057;11-08-2017;11-08-2017;353195;01-08-2017;;amplasare;;"judetul Cluj, GRIGORESCU";"LUCRARI DE MONTARE STATIE DE INCARCARE AUTOBUZE ELECTRICE"
2017;1058;11-08-2017;26-07-2017;316213;06-07-2017;;construire,extindere,etajare;locuinte unifamiliale-izolate;"judetul Cluj, Strada Meseriilor, nr. 13";"EXTINDERE SI SUPRAETAJARE CASA UNIFAMILIALA, CONSTRUIRE ANEXA   In urmatoarele conditii:  Se interzice modificarea parcelarului pana la receptionarea lucrarilor si eliberarea certificatului de atestare a edificarii constructiei."
2017;1059;11-08-2017;11-08-2017;324715;12-07-2017;;amenajare;locuinte colective,amenajari interioare;"judetul Cluj, I.C.Bratianu, nr. 33, ap. 11";"AMENAJARI SI RECOMPARTIMENTARI INTERIOARE APARTAMENT"
2017;1060;11-08-2017;11-08-2017;338363;21-07-2017;;amplasare;;"judetul Cluj, Primaverii , nr. 2, ap. 39";"AMPLASARE FIRMA PE FATADA IMOBILULUI CU CARACTER PROVIZORIU SI DEMONTABIL"
2017;1061;11-08-2017;26-07-2017;333318;18-07-2017;P+E;construire,amenajare;locuinte unifamiliale-izolate,amenajari exterioare;"judetul Cluj, colonia sopor, nr. 2b";"CONSTRUIRE CASA UNIFAMILIALA P+E SI AMENAJARI EXTERIOARE  In urmatoarele conditii:  Se interzice modificarea parcelarului pana la receptionarea lucrarilor si eliberarea certificatului de atestare a edificarii constructiei."
2017;1062;11-08-2017;11-08-2017;330538;17-07-2017;P+M;construire,continuare lucrari;locuinte unifamiliale-izolate;"judetul Cluj, str.Doinei, nr. 54/B";"CONTINUARE LUCRARI FARA MODIFICAREA SOLUTIEI CONSTRUCTIVE AUTORIZATA INITIAL CU AC 15 DIN 14.09.2009 SI AC 978 DIN 01.08.2013 PENTRU „CONSTRUIRE LOCUINTA FAMILIALA P+M”"
